timestamp,pais,title,summary,score,lat,lon,source,categoria,sentiment,sentiment_score
2026-03-26 23:55,Ukraine,Zelensky visits Saudi Arabia after offering Ukraine's drone expertise,"There is renewed urgency for Ukraine to get a drone deal done, as the US increasingly focuses on Iran.",1,50.45,30.52,http://feeds.bbci.co.uk/news/world/rss.xml,General,NEU,0.0
2026-03-26 23:55,Iran,Rationing power and diluting petrol - how African countries are coping with effects of Iran war,The disruption in oil supplies has caused shortages and concerns in several African countries.,5,35.69,51.39,http://feeds.bbci.co.uk/news/world/rss.xml,Militar,NEU,0.0
2026-03-26 23:55,Venezuela,US prosecutors argue Maduro 'plundered' Venezuelan wealth in court battle over legal fees,A judge said the right to defence was paramount as prosecutors argued the couple should not be able to use Venezuelan funds to pay lawyers.,2,10.48,-66.88,http://feeds.bbci.co.uk/news/world/rss.xml,Político,NEU,0.0
2026-03-26 23:55,Unknown,Spanish woman dies by euthanasia after long legal battle with father,The European Court of Human Rights (ECHR) ruled in Noelia Castillo's favour earlier this week.,2,,,http://feeds.bbci.co.uk/news/world/rss.xml,Político,NEU,0.0
2026-03-26 23:55,Unknown,Olympic women's sport limited to biological females,"The women's category of Olympic sports will be limited to biological females from 2028, says the International Olympic Committee.",1,,,http://feeds.bbci.co.uk/news/world/rss.xml,General,NEU,0.0
2026-03-26 23:55,France,Air Canada CEO 'deeply saddened' his English-only message distracted from victims of crash,"Michael Rousseau has faced calls to resign for not speaking French in his message after the LaGuardia crash, which killed two Air Canada pilots.",4,48.86,2.35,http://feeds.bbci.co.uk/news/world/rss.xml,General,NEU,0.0
2026-03-26 23:55,France,French court hands Islam scholar Tariq Ramadan 18-year jail term for rape,"Ramadan, a 63-year-old former Oxford professor, denied the charges but his lawyers said he was too ill to attend the trial.",1,48.86,2.35,http://feeds.bbci.co.uk/news/world/rss.xml,Político,NEU,0.0
2026-03-26 23:55,Zimbabwe,Zimbabwe says 15 nationals killed after being lured to fight for Russia,Zimbabwe says it is engaging the Russian government to repatriate bodies and bring home those still alive.,4,-17.83,31.05,http://feeds.bbci.co.uk/news/world/rss.xml,Político,NEU,0.0
2026-03-26 23:55,Russia,Russia bans Oscar-winning film 'Mr Nobody Against Putin',"A court alleges that the documentary promoted ""negative attitudes"" about the Russian government and the war in Ukraine.",5,55.75,37.62,http://feeds.bbci.co.uk/news/world/rss.xml,Político,NEU,0.0
2026-03-26 23:55,EU,European Parliament gives conditional approval to EU-US trade deal,The agreement would see EU tariffs on US goods reduced to zero while US tariffs on EU imports set at 15%.,1,50.85,4.35,http://feeds.bbci.co.uk/news/world/rss.xml,Diplomático,NEU,0.0
2026-03-26 23:55,China,Trump confirms May meeting with Xi Jinping as Iran war forces postponement,Trump's delayed meeting with Xi Jinping will be the first visit to China by a US president since 2017.,5,39.91,116.39,http://feeds.bbci.co.uk/news/world/rss.xml,Militar,NEU,0.0
2026-03-26 23:55,India,New India bill to amend transgender rights sparks protests,The bill seeks to change how transgender people are legally recognised and their right to self-identify.,2,28.61,77.21,http://feeds.bbci.co.uk/news/world/rss.xml,Político,NEU,0.0
2026-03-26 23:55,Unknown,Prepare for turbulence - how a prolonged Middle East conflict could reshape how we fly,The Gulf's hub airports made long-distance travel cheaper - but now their future looks unclear.,3,,,http://feeds.bbci.co.uk/news/world/rss.xml,General,NEU,0.0
2026-03-26 23:55,Philippines,'We are being choked': Philippines transport workers strike over fuel costs,It comes as a ship carrying barrels of Russian crude oil arrived in the Philippines earlier this week.,1,14.6,120.98,http://feeds.bbci.co.uk/news/world/rss.xml,Energético,NEU,0.0
2026-03-26 23:55,Philippines,How the Iran war is causing fuel chaos in the Philippines,BBC News Asia Business Correspondent Suranajana Tewari spoke to people taking to the streets of Manila.,5,14.6,120.98,http://feeds.bbci.co.uk/news/world/rss.xml,Militar,NEU,0.0
2026-03-26 23:55,China,What happened in the seconds before Air Canada plane crashed at LaGuardia,BBC Verify breaks down the moments before the deadly collision with a fire truck at the New York airport.,4,39.91,116.39,http://feeds.bbci.co.uk/news/world/rss.xml,General,NEU,0.0
2026-03-26 23:55,China,How the deadly LaGuardia Airport crash unfolded,Video shows the aftermath of the collision between a passenger plane and a firefighting vehicle on the runway of the New York airport.,4,39.91,116.39,http://feeds.bbci.co.uk/news/world/rss.xml,General,NEU,0.0
2026-03-26 23:55,Palestine,Watch: Inside Palestinian homes attacked by settlers,"Violence began after a teenage settler was killed, reportedly after being hit by a vehicle driven by a Palestinian.",4,31.9,35.3,http://feeds.bbci.co.uk/news/world/rss.xml,General,NEU,0.0
2026-03-26 23:55,Yemen,Iran war: Houthi restraint driven by local priorities,"Despite threatening to intervene in the war in Iran, the Iran-backed Yemeni Houthi militia has so far remained passive. What are the reasons?",5,15.55,48.52,https://rss.dw.com/rdf/rss-en-world,Militar,NEU,0.0
2026-03-26 23:55,UN,UN resolution fuels global slavery reparations debate,"A landmark UN resoultion has intensified the debate over reparations for the transatlantic slave trade, with supporters arguing that recognition, apologies and structural reforms are long overdue.",1,40.75,-73.97,https://rss.dw.com/rdf/rss-en-world,Energético,NEU,0.0
2026-03-26 23:55,Germany,European NATO defense spending rose by almost 20% in 2025,"European NATO members and Canada increased their defense spending by an aggregate of 19.6% in 2025, the second consecutive year at that rate. German defense spending, famously sluggish to rise, reached 2.4% of GDP.",1,52.52,13.4,https://rss.dw.com/rdf/rss-en-world,Diplomático,NEU,0.0
2026-03-26 23:55,USA,US war in Iran: China casts itself as savior of SE Asia,"As the US-Israel war with Iran sends fuel prices surging across Southeast Asia, Beijing is using the crisis to position itself as a steadier and more reliable partner than Washington.",5,38.9,-77.04,https://rss.dw.com/rdf/rss-en-world,Militar,NEU,0.0
2026-03-26 23:55,India,India sees spike in social media censorship amid Iran war,"Activists in India are sounding the alarm over the removal of content from social media, especially posts criticizing the government and its Iran war stance.",5,28.61,77.21,https://rss.dw.com/rdf/rss-en-world,Militar,NEU,0.0
2026-03-26 23:55,Iran,Australia bans visitors from Iran for 6 months amid war,Australia is concerned Iranian visitors may overstay their visas because of the war in the Middle East.,5,35.69,51.39,https://rss.dw.com/rdf/rss-en-world,Militar,NEU,0.0
2026-03-26 23:55,Iran,An Iranian to negotiate with: Who is Mohammad Qalibaf?,"Mohammad Bagher Qalibaf is one of Iran's most influential politicians and has close ties to the military. But he is also often associated with corruption, as well as his role in the suppression of protests.",2,35.69,51.39,https://rss.dw.com/rdf/rss-en-world,Militar,NEU,0.0
2026-03-26 23:55,Russia,Hungarian election: Will Europe's far-right help Orban win?,"Leading European populists are throwing their weight behind Viktor Orban's reelection campaign. But the Hungarian prime minister lags behind the opposition due to talk of corruption, scandal and his Russian ties.",1,55.75,37.62,https://rss.dw.com/rdf/rss-en-world,Político,NEU,0.0
2026-03-26 23:55,Unknown,How countries are tackling the global energy crisis,"With energy prices soaring and the Strait of Hormuz still closed, the world must cut demand. From 4-day workweeks and petrol rations to turning down the air con, here's what some countries are trying.",2,,,https://rss.dw.com/rdf/rss-en-world,Energético,NEU,0.0
2026-03-26 23:55,Nigeria,Nigeria moves to broaden security alliances amid ongoing insurgency threats,"Nigeria is expanding security partnerships as extremist threats rise, strengthening cooperation with France, receiving continued US military support, and renewing engagement with EU leaders.",2,9.07,7.4,https://rss.dw.com/rdf/rss-en-world,Militar,NEU,0.0
2026-03-26 23:55,USA,Are US-Iran peace talks actually happening? Everything we know so far,Donald Trump's claim that&#160;members of his administration are negotiating with Iran on the ongoing conflict has caused more confusion than clarity.&#160;,3,38.9,-77.04,https://feeds.skynews.com/feeds/rss/world.xml,Diplomático,NEU,0.0
2026-03-26 23:55,Japan,"'Get out, get out!': Max Verstappen kicks journalist out of press conference",Former Formula 1 champion Max Verstappen kicked a reporter out of a press conference ahead of Sunday's Japanese Grand Prix.,1,35.69,139.69,https://feeds.skynews.com/feeds/rss/world.xml,General,NEU,0.0
2026-03-26 23:55,Germany,'Every minute counts' in stranded whale rescue attempt,"Rescuers who have been trying to free a whale stranded in shallow water off the north German coast have said ""every minute counts"" as they battle to release the animal.",2,52.52,13.4,https://feeds.skynews.com/feeds/rss/world.xml,Humanitario,NEU,0.0
2026-03-26 23:55,Palestine,"Palestinian teenager was starved in prison before death, judge rules","A Palestinian teenager was starved in an Israeli prison before his death, a judge ruled before closing the case.",1,31.9,35.3,https://feeds.skynews.com/feeds/rss/world.xml,General,NEU,0.0
2026-03-26 23:55,China,Floods in Kenya leave 88 dead and thousands displaced,"The number killed in floods in Kenya has risen to 88, the government has said, as two rivers burst their banks causing more displacement.",4,39.91,116.39,https://feeds.skynews.com/feeds/rss/world.xml,Humanitario,NEU,0.0
2026-03-26 23:55,Denmark,Danish PM faces fight to stay in post after election losses,Denmark's centre-left prime minister has said she wants to stay in her job after inconclusive election results left the country facing weeks of coalition talks.,2,55.68,12.57,https://feeds.skynews.com/feeds/rss/world.xml,Político,NEU,0.0
2026-03-26 23:55,Iran,The Iranian former commander who could be Trump's pick to negotiate with,A former commander of Iran's Revolutionary Guards has emerged as a possible US contact for talks - as the new Supreme Leader's condition remains uncertain.,2,35.69,51.39,https://feeds.skynews.com/feeds/rss/world.xml,Diplomático,NEU,0.0
2026-03-26 23:55,USA,Mbappe nets for 10-man France in win against Brazil in World Cup warm-up,"France beat Brazil 2-1 in a friendly in United States, in what was a potential dress rehearsal for World Cup 2026 final.",5,38.9,-77.04,https://www.aljazeera.com/xml/rss/all.xml,Militar,NEU,0.0
2026-03-26 23:55,Unknown,Manila’s streets empty as fuel prices surge amid Strait of Hormuz crisis,"Empty streets expose another crisis as Filipinos battle soaring oil prices, dwindling incomes, and a stagnating economy.",2,,,https://www.aljazeera.com/xml/rss/all.xml,Energético,NEU,0.0
2026-03-26 23:55,Israel,Why Iraq is the most fragile front in the US-Israel war on Iran,Iraq is under attack from all sides as militias and foreign powers clash.,5,31.77,35.21,https://www.aljazeera.com/xml/rss/all.xml,Militar,NEU,0.0
2026-03-26 23:55,Unknown,Police fire water cannons at Chile student protest,Police in Chile fired water cannons at students gathering in central Santiago to protest education policies.,2,,,https://www.aljazeera.com/xml/rss/all.xml,Político,NEU,0.0
2026-03-26 23:55,Mexico,Argentina declares Jalisco New Generation Cartel a ‘terrorist’ group,President Javier Milei&#039;s office said the designation &#039;strengthens international cooperation&#039; against crime.,1,19.43,-99.13,https://www.aljazeera.com/xml/rss/all.xml,Humanitario,NEU,0.0
2026-03-26 23:55,Iran,What are the red lines for Iran and the US in the war?,Tehran says US list of 15 demands does not reflect reality.,5,35.69,51.39,https://www.aljazeera.com/xml/rss/all.xml,Militar,NEU,0.0
2026-03-26 23:55,Iran,Trump postpones US strikes on Iranian power grid to April 6 amid talks,"The US president has threatened the attacks as a means of pressuring Iran to reopen Strait of Hormuz, a vital waterway.",3,35.69,51.39,https://www.aljazeera.com/xml/rss/all.xml,Energético,NEU,0.0
2026-03-26 23:55,Unknown,WTO holds crunch meeting amid growing uncertainty over multilateral system,"Tariff wars smashed old system, but failure to agree on reforms could see ‘some people writing a new rulebook’.",5,,,https://www.aljazeera.com/xml/rss/all.xml,Militar,NEU,0.0
2026-03-26 23:55,Israel,Al Jazeera visits Iran’s UNESCO-listed palace damaged by war,"Al Jazeera visited Tehran&#039;s UNESCO-listed Golestan Palace, which Iran says was damaged by US-Israeli strikes.",5,31.77,35.21,https://www.aljazeera.com/xml/rss/all.xml,Militar,NEU,0.0
2026-03-26 23:55,UN,"At least nine people dead, dozens missing as boat sinks off Djibouti coast",Rescue operation recovers 266 survivors as UN warns deadliest season on the route is just beginning.,5,40.75,-73.97,https://www.aljazeera.com/xml/rss/all.xml,Militar,NEU,0.0
2026-03-26 23:55,Iran,Iran placing messages on missiles as war of narratives intensifies,Iran’s military has released a video showing a message being placed on a missile ahead of launch.,5,35.69,51.39,https://www.aljazeera.com/xml/rss/all.xml,Militar,NEU,0.0
2026-03-26 23:55,Venezuela,Protests erupt outside US court over Maduro case,Supporters and opponents of Nicolas Maduro gathered outside a New York court.,2,10.48,-66.88,https://www.aljazeera.com/xml/rss/all.xml,Político,NEU,0.0
2026-03-26 23:55,Israel,Israel sends more troops into southern Lebanon as ground invasion expands,Lebanon&#039;s PM warns Israeli actions and statements threaten Lebanese sovereignty and violate international law.,5,31.77,35.21,https://www.aljazeera.com/xml/rss/all.xml,Militar,NEU,0.0
2026-03-26 23:55,Venezuela,US judge weighs Trump decision to bar Venezuelan funds for Maduro’s defence,Judge Hellerstein declined to dismiss the case against Maduro but questioned US prosecutors about his access to defence.,1,10.48,-66.88,https://www.aljazeera.com/xml/rss/all.xml,General,NEU,0.0
2026-03-26 23:55,USA,Key takeaways from Trump’s war on Iran meeting,US President Donald Trump held a cabinet meeting where he discussed the war on Iran with senior officials.,5,38.9,-77.04,https://www.aljazeera.com/xml/rss/all.xml,Militar,NEU,0.0
2026-03-26 23:55,Israel,Trump says Iran ‘begging’ for deal to end war as Tehran issues new demands,"Trump says US, Israel wiped out navy and air force, as Iran lawmakers plan to collect tolls for transiting ships.",5,31.77,35.21,https://www.aljazeera.com/xml/rss/all.xml,Militar,NEU,0.0
2026-03-26 23:55,N. Korea,Kim Jong Un gifted gun after Belarus friendship treaty,Belarusian President Alexander Lukashenko gifted North Korean leader Kim Jong Un a gun.,1,39.02,125.75,https://www.aljazeera.com/xml/rss/all.xml,Diplomático,NEU,0.0
2026-03-26 23:55,Iran,Iranian missiles cause widespread damage across Israel in latest wave,Iranian missiles have caused widespread damage across Israel in the latest wave of attacks.,3,35.69,51.39,https://www.aljazeera.com/xml/rss/all.xml,Militar,NEU,0.0
2026-03-26 23:55,Lebanon,More than one million displaced by Israel’s evacuations in Lebanon,"More than 250,000 people flee Lebanon in two weeks, with 125,000 crossing into Syria, including 7,000 Lebanese citizens.",1,33.89,35.5,https://www.aljazeera.com/xml/rss/all.xml,Humanitario,NEU,0.0
2026-03-26 23:55,UK,London police officer filmed in crowd intimidating Al Jazeera journalists,"Metropolitan Police says reviewing footage of incident, reporters must be able to work &#039;without intimidation&#039;.",1,51.51,-0.13,https://www.aljazeera.com/xml/rss/all.xml,General,NEU,0.0
2026-03-26 23:55,Palestine,Details revealed of Board of Peace plan for Gaza disarmament,"Plan, submitted by Board of Peace head Nikolay Mladenov, calls for gradual disarmament over eight months.",1,31.9,35.3,https://www.aljazeera.com/xml/rss/all.xml,General,NEU,0.0
2026-03-26 23:55,USA,"Pentagon boss claims Iran now has ‘no navy, no navy leader’",Defense Secretary Pete Hegseth has said that Iran war is &#039;stuff for the history books&#039;.,5,38.9,-77.04,https://www.aljazeera.com/xml/rss/all.xml,Militar,NEU,0.0
