timestamp,pais,title,summary,score,lat,lon,source,categoria,sentiment,sentiment_score
2026-03-31 19:55,Iran,"Iran using children in security roles in war, reports and witnesses say",An 11-year-old is reported to have been killed in an air strike while manning a checkpoint in Tehran.,5,35.69,51.39,http://feeds.bbci.co.uk/news/world/rss.xml,Militar,NEU,0.0
2026-03-31 19:55,Lebanon,Israel says it will keep control over part of southern Lebanon after war with Hezbollah ends,Defence Minister Israel Katz also says houses in Lebanese villages near the Israeli border will be demolished.,5,33.89,35.5,http://feeds.bbci.co.uk/news/world/rss.xml,Militar,NEU,0.0
2026-03-31 19:55,Germany,Wolf bites woman in shock German attack in Hamburg shopping street,It is believed to be the first wolf attack on a human since the animals began to reestablish themselves in Germany decades ago.,3,52.52,13.4,http://feeds.bbci.co.uk/news/world/rss.xml,General,NEU,0.0
2026-03-31 19:55,Russia,Russian oil tanker docks in Cuba ending near-total blockade,"A Russian oil tanker has docked in Cuba, providing temporary relief after months of shortages.",3,55.75,37.62,http://feeds.bbci.co.uk/news/world/rss.xml,Energético,NEU,0.0
2026-03-31 19:55,Haiti,At least 16 killed and thousands displaced by gang attack in rural Haiti,"The attack happened in the Artibonite region, where members of the Gran Grif gang have targeted locals in the past.",4,18.54,-72.34,http://feeds.bbci.co.uk/news/world/rss.xml,Humanitario,NEU,0.0
2026-03-31 19:55,Unknown,Teen cyclist killed at Road World Championships not found for 82 minutes,"A cyclist who was killed during the Road World Championships was not found for 82 minutes after a crash, investigators find.",4,,,http://feeds.bbci.co.uk/news/world/rss.xml,General,NEU,0.0
2026-03-31 19:55,Sudan,"Sexual violence part of 'everyday life' in parts of Sudan, charity says",Victims describe how they have been targeted while carrying out everyday activities.,1,15.55,32.53,http://feeds.bbci.co.uk/news/world/rss.xml,General,NEU,0.0
2026-03-31 19:55,Palestine,Palestinians convicted of lethal attacks face death penalty under new Israeli law,"The new law, passed on Monday, was pushed hard by the far-right and Security Minister Itamar Ben-Gvir.",3,31.9,35.3,http://feeds.bbci.co.uk/news/world/rss.xml,Político,NEU,0.0
2026-03-31 19:55,Unknown,Kid Rock sparks US Army probe after helicopter flyby at his mansion,The country rock artist posted footage on Saturday of himself saluting the aircraft from his outdoor pool.,1,,,http://feeds.bbci.co.uk/news/world/rss.xml,Militar,NEU,0.0
2026-03-31 19:55,Pakistan,How Pakistan won over Trump to become an unlikely mediator in the Iran war,Pakistan's role as intermediary in this conflict took many by surprise. But perhaps it shouldn't have.,5,33.72,73.06,http://feeds.bbci.co.uk/news/world/rss.xml,Militar,NEU,0.0
2026-03-31 19:55,Iran,Inside the cockpit of RAF tanker during defensive mission against Iranian drones,Defence correspondent Jonathan Beale flies onboard a Royal Air Force Voyager as it refuels jets in the Middle East.,1,35.69,51.39,http://feeds.bbci.co.uk/news/world/rss.xml,Energético,NEU,0.0
2026-03-31 19:55,Myanmar,Long queues in Myanmar as Iran war fuel crisis deepens,Drivers are queuing for hours at petrol stations in Myanmar as the Iran war continues to send shockwaves across the globe.,5,19.74,96.08,http://feeds.bbci.co.uk/news/world/rss.xml,Militar,NEU,0.0
2026-03-31 19:55,USA,How the US could try to seize Iran's Kharg Island,Donald Trump has indicated he could send troops to take control of Iran's key oil export terminal.,3,38.9,-77.04,http://feeds.bbci.co.uk/news/world/rss.xml,Militar,NEU,0.0
2026-03-31 19:55,Unknown,"Shock, sadness and relief in town at centre of Australia's seven-month manhunt for Dezi Freeman",Porepunkah has been in the spotlight since Dezi Freeman shot dead two police officers last year.,4,,,http://feeds.bbci.co.uk/news/world/rss.xml,General,NEU,0.0
2026-03-31 19:55,Unknown,Fuel rations and free buses: How countries are responding to rising oil prices,Governments around the world have introduced measures to limit the impact of price increases.,1,,,http://feeds.bbci.co.uk/news/world/rss.xml,Energético,NEU,0.0
2026-03-31 19:55,China,Why Chinese tech companies are racing to set up in Hong Kong,Mainland firms are using the territory to test products and as a springboard for global expansion.,1,39.91,116.39,http://feeds.bbci.co.uk/news/world/rss.xml,General,NEU,0.0
2026-03-31 19:55,Unknown,How Australia’s seven-month-long manhunt came to an end,Fugitive Dezi Freeman has been wanted since he shot dead two police officers on his rural property in August last year.,4,,,http://feeds.bbci.co.uk/news/world/rss.xml,General,NEU,0.0
2026-03-31 19:55,Israel,Hundreds in Beirut mourn journalists killed in Israeli strike,BBC reports from the funerals of three journalists killed by a targeted attack in southern Lebanon.,4,31.77,35.21,http://feeds.bbci.co.uk/news/world/rss.xml,General,NEU,0.0
2026-03-31 19:55,Cuba,Expectant mothers in Cuba struggle under fuel blockade,The BBC's Will Grant speaks to two women experiencing starkly different realities as the country's energy crisis impacts their pregnancies.,3,23.13,-82.38,http://feeds.bbci.co.uk/news/world/rss.xml,Energético,NEU,0.0
2026-03-31 19:55,Lebanon,'Our home is gone': BBC speaks to displaced families in Lebanon,The BBC's Hugo Bachega speaks to families in Beirut as more than a million people have been displaced in Lebanon.,1,33.89,35.5,http://feeds.bbci.co.uk/news/world/rss.xml,Humanitario,NEU,0.0
2026-03-31 19:55,China,Why is it so hard to pass through the Strait of Hormuz?,"Paul Adams explains why it is so dangerous to navigate the strait, one of the world's busiest oil shipping channels.",1,39.91,116.39,http://feeds.bbci.co.uk/news/world/rss.xml,Energético,NEU,0.0
2026-03-31 19:55,Russia,"Russian oil tanker docks in Cuba, the 1st since US blockade","The tanker carrying some 730,000 barrels of crude oil is sanctioned by the US, the EU and the UK amid the war in Ukraine. It comes as Cuba struggles with severe shortages after Trump's total oil blockade since January.",5,55.75,37.62,https://rss.dw.com/rdf/rss-en-world,Militar,NEU,0.0
2026-03-31 19:55,Serbia,Local elections in Serbia: Is Vucic's party losing its grip?,Serbia's ruling SNS once again secured victories in local elections — but sometimes just by a few hundred votes. Narrowing margins suggest a shifting political landscape and growing momentum for anti-government protests.,2,44.8,20.46,https://rss.dw.com/rdf/rss-en-world,Político,NEU,0.0
2026-03-31 19:55,Libya,Mediterranean sharks are vanishing in a legal void,"Along Libya's coast, sharks — including breeding females — are sold unchecked. With little enforcement and growing financial pressure on fishermen, vulnerable species are spiraling toward extinction.",1,32.9,13.18,https://rss.dw.com/rdf/rss-en-world,Militar,NEU,0.0
2026-03-31 19:55,Zimbabwe,Zimbabwe split as public weighs electoral reforms bill,"Zimbabwe has begun nationwide public hearings on a proposed bill that could extend President Mnangagwa's term and overhaul the electoral system. Supporters call it stabilizing, but critics warn it threatens democracy.",5,-17.83,31.05,https://rss.dw.com/rdf/rss-en-world,Militar,NEU,0.0
2026-03-31 19:55,Pakistan,Has Pakistan outplayed India in Iran war diplomacy?,"Pakistan is gaining diplomatic visibility during the Iran conflict, while questions are growing over India's quieter strategy.",2,33.72,73.06,https://rss.dw.com/rdf/rss-en-world,Militar,NEU,0.0
2026-03-31 19:55,China,Iran war: Chinese propaganda casts US as reckless aggressor,"Chinese state media is subtly framing the US as a belligerent, destabilizing force in the Middle East. One AI-generated video features a Persian cat and an eagle locked in battle, symbolizing the Iran war.",2,39.91,116.39,https://rss.dw.com/rdf/rss-en-world,Militar,NEU,0.0
2026-03-31 19:55,Iran,"After the Iran war, how fast could global trade recover?","The Iran war could end soon or drag on for months. When the Strait of Hormuz is reopened, the true test will be how quickly energy, fertilizer and other supply chains can bounce back.",5,35.69,51.39,https://rss.dw.com/rdf/rss-en-world,Energético,NEU,0.0
2026-03-31 19:55,Unknown,US trade chief lambasts WTO after failed talks,The US has slammed the World Trade Organization's failure to reach consensus on a key e-commerce moratorium. The top US trade official said he sees only a limited role for the international body.,1,,,https://rss.dw.com/rdf/rss-en-world,Diplomático,NEU,0.0
2026-03-31 19:55,Palestine,An in-depth look at Israel's new death penalty law,"The new law, introduced by Israel's far-right government, was passed in parliament on Monday night. It imposes the death penalty on Palestinians convicted of fatal attacks.",3,31.9,35.3,https://rss.dw.com/rdf/rss-en-world,Político,NEU,0.0
2026-03-31 19:55,Venezuela,US reopens embassy in Venezuela after seizing Nicolas Maduro,The State Department said it had formally reopened its embassy in Caracas after seven years. The US seized President Nicolas Maduro in a military raid in January and has since reestablished diplomatic ties.,2,10.48,-66.88,https://rss.dw.com/rdf/rss-en-world,Militar,NEU,0.0
2026-03-31 19:55,Nigeria,Nigeria: Curfew in Jos area after attack near university,"Gunmen attacked a bar in the city overnight, reportedly killing dozens. The Plateau State government imposed a 48-hour curfew in the area. It said the perpetrators had not been identified.",3,9.07,7.4,https://rss.dw.com/rdf/rss-en-world,Humanitario,NEU,0.0
2026-03-31 19:55,Yemen,"Iran's allies could close second crucial sea route, with 'clear and significant' impact on UK",The entry of Yemen's Houthi rebels into the war on the side of Iran has stoked fears that the oil crisis affecting global trade could get worse.,5,15.55,48.52,https://feeds.skynews.com/feeds/rss/world.xml,Militar,NEU,0.0
2026-03-31 19:55,Palestine,Israel passes controversial death penalty law,Israel has passed a law making the death penalty by hanging the default punishment for West Bank Palestinians convicted of murdering Israelis.,1,31.9,35.3,https://feeds.skynews.com/feeds/rss/world.xml,Político,NEU,0.0
2026-03-31 19:55,Unknown,Man extradited from Scotland and charged with 2006 murder of ex-Sinn Fein official,A man has appeared in a Dublin court after being charged with the murder of a former Sinn Fein official who was shot dead 20 years ago.,1,,,https://feeds.skynews.com/feeds/rss/world.xml,Político,NEU,0.0
2026-03-31 19:55,Unknown,Fugitive accused of killing two police officers 'shot dead',"A fugitive accused of killing two police officers is believed to have been shot dead, Australian police have said.",4,,,https://feeds.skynews.com/feeds/rss/world.xml,Humanitario,NEU,0.0
2026-03-31 19:55,UK,Russia kicks out British diplomat accused of spying,Russia has kicked out a British diplomat that Moscow has accused of spying.,2,51.51,-0.13,https://feeds.skynews.com/feeds/rss/world.xml,Diplomático,NEU,0.0
2026-03-31 19:55,Israel,Hundreds of mourners gather in pouring rain for funerals of Lebanon journalists,Hundreds of mourners turned out in the pouring rain in Beirut for the funerals of three journalists killed by Israeli strikes in southern Lebanon.&#160;,4,31.77,35.21,https://feeds.skynews.com/feeds/rss/world.xml,General,NEU,0.0
2026-03-31 19:55,Iran,"As many as 70 Brits detained in UAE over Iran war images, claims campaign group","Up to 70 UK citizens have been detained in the United Arab Emirates (UAE) for taking photos and videos of Iranian attacks, it has been claimed by a British-based campaign group.",2,35.69,51.39,https://feeds.skynews.com/feeds/rss/world.xml,Militar,NEU,0.0
2026-03-31 19:55,Russia,Major explosion at Russian petrochemical plant,"A massive explosion occurred at a major petrochemical plant in Russia, killing at least two people and injuring dozens.",1,55.75,37.62,https://www.aljazeera.com/xml/rss/all.xml,General,NEU,0.0
2026-03-31 19:55,Iraq,Foreign journalist kidnapped in Iraq: Interior Ministry,This is a breaking news story.,1,33.34,44.4,https://www.aljazeera.com/xml/rss/all.xml,General,NEU,0.0
2026-03-31 19:55,Iran,Why Iran believes it can outlast the US,Iran is preparing for deeper US escalation while insisting it’s winning. Can this war end before it widens?,5,35.69,51.39,https://www.aljazeera.com/xml/rss/all.xml,Militar,NEU,0.0
2026-03-31 19:55,Qatar,Qatar says ‘ready to help’ with US-Iran negotiations,Qatari Foreign Ministry spokesperson Majed al-Ansari says Qatar is “ready to help” with US-Iran negotiations.,2,25.29,51.53,https://www.aljazeera.com/xml/rss/all.xml,Diplomático,NEU,0.0
2026-03-31 19:55,UK,UK accused of ‘intimidation tactics’ against bailed pro-Palestine activists,"In the space of a week, two young women linked to Palestine Action have been arrested in the UK.",1,51.51,-0.13,https://www.aljazeera.com/xml/rss/all.xml,General,NEU,0.0
2026-03-31 19:55,Israel,UN aid chief warns of new Israeli occupation in southern Lebanon,"As Israel expands Lebanon invasion, Tom Fletcher asks how world will prepare for &#039;new addition&#039; to occupied territory.",5,31.77,35.21,https://www.aljazeera.com/xml/rss/all.xml,Militar,NEU,0.0
2026-03-31 19:55,USA,Trump attacks NATO allies as pressure mounts over Strait of Hormuz,Al Jazeera’s Alan Fisher explains what Trump’s latest criticism of US allies means.,3,38.9,-77.04,https://www.aljazeera.com/xml/rss/all.xml,Energético,NEU,0.0
2026-03-31 19:55,Iran,Qatar says Iran’s attacks on neighbours crossed ‘many red lines’,"Iranian attacks on Qatar are having a &#039;catastrophic effect on the relationship between the two countries&#039;, Doha says.",3,35.69,51.39,https://www.aljazeera.com/xml/rss/all.xml,General,NEU,0.0
2026-03-31 19:55,Cuba,"Cuba crisis explained: Who holds power, and could Diaz-Canel be replaced?","As Cuba faces one of the worst humanitarian crises in its history, questions have emerged about the island&#039;s leadership.",2,23.13,-82.38,https://www.aljazeera.com/xml/rss/all.xml,Humanitario,NEU,0.0
2026-03-31 19:55,Venezuela,Venezuela’s ‘Chavismo’ movement faces a crossroads after US attack,Hugo Chavez founded a movement opposed to US intervention. How have his supporters adapted to new US-Venezuela ties?,3,10.48,-66.88,https://www.aljazeera.com/xml/rss/all.xml,General,NEU,0.0
2026-03-31 19:55,Palestine,The attack on the right to protest in the UK is not just about Palestine,Patterns of politicised policing uncovered in a recent trial of pro-Palestinian activists should worry us all.,2,31.9,35.3,https://www.aljazeera.com/xml/rss/all.xml,Político,NEU,0.0
2026-03-31 19:55,Israel,"Iran will play World Cup games in US despite war, FIFA’s Infantino says",The chief of global football&#039;s governing body says US-Israeli war on Iran will not affect scheduling of 2026 World Cup.,1,31.77,35.21,https://www.aljazeera.com/xml/rss/all.xml,Militar,NEU,0.0
2026-03-31 19:55,Iran,Where to invest during Iran war? Ask – or don’t – Mohammad Bagher Ghalibaf,"Iran’s parliamentary speaker is using X to shape market sentiment, blending war messaging with financial signalling.",1,35.69,51.39,https://www.aljazeera.com/xml/rss/all.xml,Militar,NEU,0.0
2026-03-31 19:55,USA,War on Iran: US’s history of making other nations pay for conflicts,White House says Trump could ask Arab nations to bear the cost of the Iran war.,5,38.9,-77.04,https://www.aljazeera.com/xml/rss/all.xml,Militar,NEU,0.0
2026-03-31 19:55,Israel,"Cancer drug facility, religious site hit in Israeli-US strikes on Iran","The Iranian government said the company&#039;s drug production line has been damaged, as no diplomatic solution is in sight.",2,31.77,35.21,https://www.aljazeera.com/xml/rss/all.xml,Diplomático,NEU,0.0
2026-03-31 19:55,Pakistan,Will China join Pakistan-led efforts to mediate US-Iran peace?,Pakistan&#039;s Deputy PM Ishaq Dar visits China after Islamabad talks to broker negotiations between the US and Iran.,2,33.72,73.06,https://www.aljazeera.com/xml/rss/all.xml,Diplomático,NEU,0.0
2026-03-31 19:55,Israel,Tyre hospital ‘hit five times’ since start of Israel’s attacks on Lebanon,"A hospital in southern Lebanon has been subjected to Israeli attacks for a fifth time, as Israeli forces advance further",3,31.77,35.21,https://www.aljazeera.com/xml/rss/all.xml,Humanitario,NEU,0.0
2026-03-31 19:55,Iran,US defence secretary says next few days in Iran war will be ‘decisive’,US Defence Secretary Pete Hegseth warned the coming days of the war with Iran will be ‘decisive.&#039;,5,35.69,51.39,https://www.aljazeera.com/xml/rss/all.xml,Militar,NEU,0.0
2026-03-31 19:55,Palestine,What’s Israel’s death penalty law that only applies to Palestinians?,"Rights groups condemn Israel&#039;s new law, which will primarily apply to Palestinians, as discriminatory.",1,31.9,35.3,https://www.aljazeera.com/xml/rss/all.xml,Diplomático,NEU,0.0
2026-03-31 19:55,Pakistan,Pakistan cricketer Fakhar Zaman handed two-match PSL ban for ball tampering,Lahore Qalandars batter was found guilty of changing the condition of the ball in the match against Karachi Kings.,1,33.72,73.06,https://www.aljazeera.com/xml/rss/all.xml,General,NEU,0.0
2026-03-31 19:55,Indonesia,Three Indonesian peacekeepers killed by Israeli attacks in Lebanon,Two Israeli attacks in southern Lebanon have killed three Indonesian UN peacekeepers in the past 48 hours.,4,-6.21,106.85,https://www.aljazeera.com/xml/rss/all.xml,Diplomático,NEU,0.0
2026-03-31 19:55,Israel,Iranian rescuers save two civilians from rubble after US-Israeli strikes,Footage shows Iranian Red Crescent Society rescuers and firemen saving two civilians from underneath the rubble.,1,31.77,35.21,https://www.aljazeera.com/xml/rss/all.xml,Humanitario,NEU,0.0
