timestamp,pais,title,summary,score,lat,lon,source,categoria,sentiment,sentiment_score
2026-04-02 18:55,Israel,'Be serious... don't speak every day': Macron criticises Trump approach to Iran war,The comments were an apparent jab at the US leader's sometimes contradictory stance on the US-Israeli war against Iran.,5,31.77,35.21,http://feeds.bbci.co.uk/news/world/rss.xml,Militar,NEU,0.0
2026-04-02 18:55,Brazil,Brazil grants joint custody over pets in new law for separated couples,Lawmakers in the Brazilian Congress view the law change as a reflection of pets' importance for their owners.,2,-15.78,-47.93,http://feeds.bbci.co.uk/news/world/rss.xml,Político,NEU,0.0
2026-04-02 18:55,Venezuela,US lifts sanctions on Venezuelan interim leader Delcy Rodríguez,It is the latest sign of warming relations between the US and Venezuela after Nicolás Maduro was seized in a commando raid.,5,10.48,-66.88,http://feeds.bbci.co.uk/news/world/rss.xml,Militar,NEU,0.0
2026-04-02 18:55,Unknown,"Baby shot dead in pram in New York City, police say","The seven-month-old child is the unintended victim of a suspected gang-related shooting, officials say.",4,,,http://feeds.bbci.co.uk/news/world/rss.xml,General,NEU,0.0
2026-04-02 18:55,Iran,"Iranian Nobel laureate suffered suspected heart attack in prison, family says",Narges Mohammadi's brother says he fears her life is in imminent danger and she needs to be transferred to a hospital.,3,35.69,51.39,http://feeds.bbci.co.uk/news/world/rss.xml,Humanitario,NEU,0.0
2026-04-02 18:55,Indonesia,"Magnitude 7.4 earthquake hits off Indonesia, killing one",The quake struck between the islands of Manado and Ternate. Tsunami warnings have now been lifted.,5,-6.21,106.85,http://feeds.bbci.co.uk/news/world/rss.xml,Militar,NEU,0.0
2026-04-02 18:55,Burkina Faso,"Over 1,800 killed since junta seized power in Burkina Faso, rights group says","Human Rights Watch says Capt Traoré, other military leaders and jihadists ""may be liable"" for the killings.",4,12.37,-1.53,http://feeds.bbci.co.uk/news/world/rss.xml,Militar,NEU,0.0
2026-04-02 18:55,Unknown,What nearly went wrong on Nasa's space mission - and what still could,"The Artemis II crew are now hurtling around the Earth's orbit, carrying out final tests and checks before they head towards the Moon.",5,,,http://feeds.bbci.co.uk/news/world/rss.xml,Militar,NEU,0.0
2026-04-02 18:55,USA,Trump leaves key questions unanswered as he seeks to calm nerves over Iran war,"There were some glaring omissions in the US president's primetime address, writes the BBC's Gary O'Donoghue.",5,38.9,-77.04,http://feeds.bbci.co.uk/news/world/rss.xml,Militar,NEU,0.0
2026-04-02 18:55,Iran,Iran's focus on survival means same regime still firmly in place,"Tehran is showing resilience despite Trump's claims of regime change, writes BBC Persian editor Amir Azimi.",1,35.69,51.39,http://feeds.bbci.co.uk/news/world/rss.xml,General,NEU,0.0
2026-04-02 18:55,USA,What do Trump's latest comments on leaving Nato mean for the alliance?,Trump has criticised Nato members for showing a lack of support for US objectives in Iran.,2,38.9,-77.04,http://feeds.bbci.co.uk/news/world/rss.xml,Diplomático,NEU,0.0
2026-04-02 18:55,France,Macron calls Trump's remarks on his marriage 'inelegant',"French President Emmanuel Macron has said Donald Trump's comments about his marriage were ""neither elegant nor up to standard"".",1,48.86,2.35,http://feeds.bbci.co.uk/news/world/rss.xml,Humanitario,NEU,0.0
2026-04-02 18:55,Israel,Middle East war: Few solutions to fuel shortages in Africa,Africa is running low on fuel. The US-Israel-Iran war has sent fuel prices skyrocketing. Are African countries doing enough to calm the fuel market?,1,31.77,35.21,https://rss.dw.com/rdf/rss-en-world,Militar,NEU,0.0
2026-04-02 18:55,Iran,"As Iran war rages, Europe gears up for energy crisis","The EU is waking up to an energy crisis and asking people to reduce energy consumption, as fears of a supply crunch set in. Energy analysts are calling for concrete measures and a boost in investments for renewables.",5,35.69,51.39,https://rss.dw.com/rdf/rss-en-world,Militar,NEU,0.0
2026-04-02 18:55,Israel,Iran war: How long can Tehran's asymmetric strategy hold?,"After many years of sanctions and weeks of US-Israeli bombing, the Iranian regime is shaken — but still very much capable of threatening the region.",2,31.77,35.21,https://rss.dw.com/rdf/rss-en-world,Militar,NEU,0.0
2026-04-02 18:55,USA,"Fact check: Donald Trump speaks on Iran, oil and economy","In a national address, US President Donald Trump spoke about the war in Iran and claimed that ""all of their original leaders"" are dead and that the US is ""totally independent"" of Middle Eastern oil. Is this true?",1,38.9,-77.04,https://rss.dw.com/rdf/rss-en-world,Militar,NEU,0.0
2026-04-02 18:55,USA,US lifts sanctions on Venezuela's acting President Delcy Rodriguez,Washington has removed sanctions on interim Venezuelan leader Delcy Rodriguez. The move comes as the US continues to gradually ease measures on Venezuela after toppling Nicolas Maduro.,3,38.9,-77.04,https://rss.dw.com/rdf/rss-en-world,Diplomático,NEU,0.0
2026-04-02 18:55,Indonesia,"Indonesia: Strong earthquake strikes Molucca ⁠Sea, killing 1","A major 7.4-magnitude earthquake has jolted northern Indonesia, killing at least one person. An initial tsunami warning has since been lifted.",5,-6.21,106.85,https://rss.dw.com/rdf/rss-en-world,Militar,NEU,0.0
2026-04-02 18:55,Afghanistan,Is Pakistan setting up a buffer zone in Afghanistan?,"Tensions on the Afghanistan-Pakistan border are escalating amid claims of a Pakistani ""security zone"" and civilian casualties. Will calls for a ceasefire have an impact?",5,34.52,69.18,https://rss.dw.com/rdf/rss-en-world,Diplomático,NEU,0.0
2026-04-02 18:55,Israel,Strikes on Iranian steel mills deal painful blow to economy,"The US-Israeli strikes on Iran's two biggest steel plants will likely harm Tehran's ability to wage war, but could also cripple Iran's economy in irreversible ways.",1,31.77,35.21,https://rss.dw.com/rdf/rss-en-world,Militar,NEU,0.0
2026-04-02 18:55,Russia,Russian military plane crash in Crimea kills at least 29,"The plane crashed in a mountainous forest area not far from Crimea's capital, Simferopol. Since the Kremlin sent troops into Ukraine, incidents involving Russian military planes have occurred frequently.",4,55.75,37.62,https://rss.dw.com/rdf/rss-en-world,Militar,NEU,0.0
2026-04-02 18:55,Palestine,Eight &#8204;Muslim-majority countries 'strongly condemn' Israel's new death penalty law,"Eight &#8204;Muslim-majority countries have ""strongly condemned"" a new Israeli law that makes death by hanging &#8203;a default &#8204;sentence for Palestinians convicted &#8203;in military courts of deadly attacks.",2,31.9,35.3,https://feeds.skynews.com/feeds/rss/world.xml,Político,NEU,0.0
2026-04-02 18:55,Israel,ICC prosecutor who issued arrest warrant for Netanyahu facing disciplinary proceedings,"The chief prosecutor of the International Criminal Court (ICC) will face disciplinary proceedings over accusations of sexual misconduct, it has been reported.",1,31.77,35.21,https://feeds.skynews.com/feeds/rss/world.xml,Militar,NEU,0.0
2026-04-02 18:55,Israel,Clear market uncertainty despite latest Trump attempt to soothe concerns,The latest attempt by Donald Trump to ease uncertainty over the US and Israel's war on Iran has only heightened investor concerns.,2,31.77,35.21,https://feeds.skynews.com/feeds/rss/world.xml,Militar,NEU,0.0
2026-04-02 18:55,Iraq,US journalist kidnapped - here's what we know so far,Footage has emerged which appears to show a US journalist being kidnapped in Iraq.,1,33.34,44.4,https://feeds.skynews.com/feeds/rss/world.xml,General,NEU,0.0
2026-04-02 18:55,EU,Dwindling diesel and jet fuel supplies due to Iran war prompt EU warning of shortages,The European Union (EU) could revive measures brought in after Russia cut gas supplies in 2022 amid a mounting energy crisis due to the Iran war.,5,50.85,4.35,https://feeds.skynews.com/feeds/rss/world.xml,Energético,NEU,0.0
2026-04-02 18:55,Israel,US reinforcements are coming to the Gulf – but what does victory look like?,Al Jazeera&#039;s defence editor looks at how the US-Israeli attack on Iran has become a regional war,5,31.77,35.21,https://www.aljazeera.com/xml/rss/all.xml,Militar,NEU,0.0
2026-04-02 18:55,Iran,Can the US seize Iran’s enriched uranium – and what are the risks?,"A military operation would pose chemical, logistical, and tactical hurdles, experts say.",3,35.69,51.39,https://www.aljazeera.com/xml/rss/all.xml,Militar,NEU,0.0
2026-04-02 18:55,Iran,Iran releases mocking missile launch video after Trump threats,Iranian state media released footage showing the launch of missiles plastered with messages mocking Donald Trump.,3,35.69,51.39,https://www.aljazeera.com/xml/rss/all.xml,Militar,NEU,0.0
2026-04-02 18:55,France,European Parliament member Rima Hassan taken into French police custody,Members of Hassan&#039;s La France Insoumise party condemn detention as part of effort to &#039;intimidate&#039; Palestine supporters.,1,48.86,2.35,https://www.aljazeera.com/xml/rss/all.xml,Político,NEU,0.0
2026-04-02 18:55,Iran,CENTCOM releases video of air strikes in fifth week of war on Iran,US Central Command has released footage of strikes in Iran appearing to show the targeting of drones and tanks.,5,35.69,51.39,https://www.aljazeera.com/xml/rss/all.xml,Militar,NEU,0.0
2026-04-02 18:55,Unknown,Can Starmer’s 40-nation coalition open the Strait of Hormuz?,About 20 percent of global oil and gas passes through the Gulf waterway.,1,,,https://www.aljazeera.com/xml/rss/all.xml,Energético,NEU,0.0
2026-04-02 18:55,Israel,Why Lebanon should join the International Criminal Court,ICC jurisdiction in Lebanon would mean a chance of accountability for Israeli war crimes and renewed political pressure.,1,31.77,35.21,https://www.aljazeera.com/xml/rss/all.xml,Político,NEU,0.0
2026-04-02 18:55,Unknown,UEFA’s Euro 2032 warning the latest blow to Italy after World Cup exit,"Days after missing out on World Cup 2026 spot, Italy are warned that their cohosting of Euro 2032 could be in doubt.",5,,,https://www.aljazeera.com/xml/rss/all.xml,Militar,NEU,0.0
2026-04-02 18:55,Burkina Faso,"Burkina Faso military, allies committing ‘horrific’ civilian abuses: HRW","More than 1,800 civilians have been killed by the army and armed groups since 2023, Human Rights Watch says.",4,12.37,-1.53,https://www.aljazeera.com/xml/rss/all.xml,Militar,NEU,0.0
2026-04-02 18:55,UK,UK-led coalition of 40 countries vows action on Hormuz Strait gridlock,UK PM Keir Starmer urges non-military solutions ahead of coalition meeting to ease gridlock in vital Strait of Hormuz.,1,51.51,-0.13,https://www.aljazeera.com/xml/rss/all.xml,Militar,NEU,0.0
2026-04-02 18:55,Pakistan,Pakistan to continue with Iran-US mediation despite ‘obstacles’,Islamabad&#039;s statement follows Trump threatening to bomb Iran &#039;back to the Stone Ages&#039;.,2,33.72,73.06,https://www.aljazeera.com/xml/rss/all.xml,Militar,NEU,0.0
2026-04-02 18:55,Unknown,‘Bomb back to the Stone Age’: US history of threats and carpet bombing,Analysts say carpet bombing countries is a war crime. But it wouldn&#039;t be new for the US.,5,,,https://www.aljazeera.com/xml/rss/all.xml,Militar,NEU,0.0
2026-04-02 18:55,Israel,"Smoke rises over Mashhad, Iran, following strike near airport","Footage shows columns of smoke rising over the Iranian city of Mashhad, after US-Israeli strikes near the airport.",1,31.77,35.21,https://www.aljazeera.com/xml/rss/all.xml,General,NEU,0.0
2026-04-02 18:55,Pakistan,Pakistan-bound ships pass through Strait of Hormuz,Two ships have passed through the Strait of Hormuz and arrived at Karachi Port.,1,33.72,73.06,https://www.aljazeera.com/xml/rss/all.xml,Energético,NEU,0.0
2026-04-02 18:55,Unknown,Four children killed in nursery school stabbing attack in Uganda,"Police say a suspect is in custody but the motive remains unknown after attack in Ugandan capital, Kampala.",4,,,https://www.aljazeera.com/xml/rss/all.xml,Humanitario,NEU,0.0
2026-04-02 18:55,Lebanon,"Israeli strikes kill 7 in southern Lebanon, Hezbollah targets ground troops",Lebanon&#039;s prime minister warns of a &#039;critical&#039; situation as Israel says it is working to dismantle Hezbollah.,5,33.89,35.5,https://www.aljazeera.com/xml/rss/all.xml,Militar,NEU,0.0
2026-04-02 18:55,Palestine,How Israel’s record budget will finance expanding illegal settlements,Budget of $271bn comes against a backdrop of surging violence by Israeli settlers towards Palestinians in the West Bank.,5,31.9,35.3,https://www.aljazeera.com/xml/rss/all.xml,Militar,NEU,0.0
2026-04-02 18:55,Libya,Libyan military leader may have combat drones despite UN embargo,Reuters news agency says satellite images show ⁠at least three drones at Al Khadim airbase between April and December.,1,32.9,13.18,https://www.aljazeera.com/xml/rss/all.xml,Militar,NEU,0.0
2026-04-02 18:55,Palestine,Eight countries condemn Israel’s one-sided death penalty for Palestinians,Muslim-majority nations denounce Israel&#039;s &#039;increasingly discriminatory&#039; practices that &#039;entrench a system of apartheid&#039;.,1,31.9,35.3,https://www.aljazeera.com/xml/rss/all.xml,Diplomático,NEU,0.0
2026-04-02 18:55,Yemen,"Yemen’s Houthis coordinate with Iran, but retain independence, despite war","Houthi actions align with Iran’s strategy, but maintain autonomy to maximise regional influence and domestic objectives.",5,15.55,48.52,https://www.aljazeera.com/xml/rss/all.xml,Militar,NEU,0.0
2026-04-02 18:55,Israel,US-Israeli attacks and its impact on Iran’s economy,US-Israeli attacks and its impact on Iran’s economy,2,31.77,35.21,https://www.aljazeera.com/xml/rss/all.xml,General,NEU,0.0
2026-04-02 18:55,USA,Trump’s tariffs one year on: How Americans are paying the price,"US households paid $1,000 more for the same goods over the past year, with lower-income families hit the hardest.",1,38.9,-77.04,https://www.aljazeera.com/xml/rss/all.xml,Humanitario,NEU,0.0
