timestamp,pais,title,summary,score,lat,lon,source,categoria,sentiment,sentiment_score
2026-04-10 12:55,Lebanon,Trump says Iran's handling of Strait of Hormuz is 'not the agreement we have',"The US president accused Iran of ""doing a very poor job"" with the waterway as Israel and Lebanon to begin peace talks.",1,33.89,35.5,http://feeds.bbci.co.uk/news/world/rss.xml,Diplomático,NEU,0.0
2026-04-10 12:55,Unknown,"Ceasefire or no ceasefire, the Middle East's reshuffling is not yet done",Both sides have reason to end the war but share no common ground.,5,,,http://feeds.bbci.co.uk/news/world/rss.xml,Militar,NEU,0.0
2026-04-10 12:55,China,Taiwan opposition leader meets Xi Jinping in Beijing,Cheng Li-wun is the Kuomintang's first sitting leader to visit China in a decade.,1,39.91,116.39,http://feeds.bbci.co.uk/news/world/rss.xml,Diplomático,NEU,0.0
2026-04-10 12:55,Ukraine,Russia and Ukraine agree to truce for Orthodox Easter,"Vladimir Putin announced the truce, which will last from Saturday afternoon on 11 April through Easter Sunday.",1,50.45,30.52,http://feeds.bbci.co.uk/news/world/rss.xml,General,NEU,0.0
2026-04-10 12:55,China,White House staff told not to place bets on prediction markets,"The gambling platforms have grown in popularity, with some users making wagers on conflicts.",2,39.91,116.39,http://feeds.bbci.co.uk/news/world/rss.xml,General,NEU,0.0
2026-04-10 12:55,Russia,UK says Russia ran submarine operation over cables and pipelines,"Defence Secretary John Healey says there is ""no evidence"" of any damage to UK infrastructure in the Atlantic.",1,55.75,37.62,http://feeds.bbci.co.uk/news/world/rss.xml,Energético,NEU,0.0
2026-04-10 12:55,South Africa,"US has let in 4,499 refugees since October - all but three were South African","Trump has given priority to Afrikaners, a white minority group he says is being persecuted. South Africa has objected to his characterisation.",1,-25.75,28.19,http://feeds.bbci.co.uk/news/world/rss.xml,Humanitario,NEU,0.0
2026-04-10 12:55,Israel,Al Jazeera condemns killing of journalist in Israeli strike in Gaza,"The Israeli military claims Mohammed Wishah was a ""Hamas terrorist"" - which the Qatar-based network has previously denied.",1,31.77,35.21,http://feeds.bbci.co.uk/news/world/rss.xml,Militar,NEU,0.0
2026-04-10 12:55,Unknown,Artemis crew returning to Earth with 'all the good stuff' from Moon discoveries,"The four astronauts said they were returning to Earth with ""so many more pictures, so many more stories"".",1,,,http://feeds.bbci.co.uk/news/world/rss.xml,Humanitario,NEU,0.0
2026-04-10 12:55,USA,Trump criticises Nato as alliance chief describes meeting as 'very frank',"The US president says Nato ""wasn't there when we needed them"" during the Iran war.",5,38.9,-77.04,http://feeds.bbci.co.uk/news/world/rss.xml,Diplomático,NEU,0.0
2026-04-10 12:55,Unknown,"Amazon to end support for older Kindles, prompting user outcry",The move means owners of Kindles released before 2013 will be unable to download new e-books.,1,,,http://feeds.bbci.co.uk/news/world/rss.xml,General,NEU,0.0
2026-04-10 12:55,Unknown,Hot in the city: Energy crisis tests Singapore's air-con addiction,The rise in energy prices has hit Asia particularly hard as many nations are heavily reliant on Gulf oil.,2,,,http://feeds.bbci.co.uk/news/world/rss.xml,Energético,NEU,0.0
2026-04-10 12:55,Lebanon,Lebanon thought there was a ceasefire - then Israel unleashed deadly blitz,Israel says Lebanon is not included in the ceasefire the US agreed to halt the war with Iran.,5,33.89,35.5,http://feeds.bbci.co.uk/news/world/rss.xml,Militar,NEU,0.0
2026-04-10 12:55,Iran,Has US achieved its war objectives in Iran?,Key US objectives at the start of the war were to stop Iran getting a nuclear weapon and degrading its arsenal.,5,35.69,51.39,http://feeds.bbci.co.uk/news/world/rss.xml,Militar,NEU,0.0
2026-04-10 12:55,Israel,What we know about the two-week ceasefire between the US and Iran,The provisional truce comes more than a month after the US and Israel launched coordinated attacks on Iran.,3,31.77,35.21,http://feeds.bbci.co.uk/news/world/rss.xml,Diplomático,NEU,0.0
2026-04-10 12:55,Unknown,Spreading Islamist insurgency dominates Benin's presidential campaign,Cross-border raids from militant Islamists are increasingly threatening the West African state's stability.,2,,,http://feeds.bbci.co.uk/news/world/rss.xml,Político,NEU,0.0
2026-04-10 12:55,Israel,BBC at the site of Israeli air strikes in Beirut,"At least 182 people were killed and 890 others wounded, according to the Lebanese health ministry.",4,31.77,35.21,http://feeds.bbci.co.uk/news/world/rss.xml,General,NEU,0.0
2026-04-10 12:55,China,China's Xi hosts Taiwan opposition leader in Beijing,Chinese leader Xi Jinping is courting Taiwan's China-friendly opposition leader as Beijing seeks to reframe the cross-strait narrative.,1,39.91,116.39,https://rss.dw.com/rdf/rss-en-world,Político,NEU,0.0
2026-04-10 12:55,Unknown,Zambia: Is the US trading HIV treatment for resources?,"The US is reportedly leveraging health aid to gain access to Zambia's critical minerals. Millions depend on US funding for HIV, tuberculosis and malaria treatment. Yet Zambia is hesitant to agree.",1,,,https://rss.dw.com/rdf/rss-en-world,Energético,NEU,0.0
2026-04-10 12:55,USA,"US: Pentagon must restore journalists' access, judge says",A federal judge has said the US Defense Department has not complied with orders to allow journalists access to the Pentagon. New rules have prevented reporters from entering the building without an escort.,1,38.9,-77.04,https://rss.dw.com/rdf/rss-en-world,Humanitario,NEU,0.0
2026-04-10 12:55,Ukraine,Ukraine: Russia's Putin declares Easter ceasefire,"Russian President Putin has announced a ceasefire in its war in Ukraine over the Orthodox Easter holiday. Ukrainian President Zelenskyy said his country will ""act accordingly"" during the truce.",5,50.45,30.52,https://rss.dw.com/rdf/rss-en-world,Militar,NEU,0.0
2026-04-10 12:55,Ukraine,Ukraine and Syria tighten relations,"Ukrainian President Volodymyr Zelenskyy's visit to Syria was not only a diplomatic gesture but motivated by strategic considerations regarding Russia, once a strong supporter of the Middle Eastern state.",3,50.45,30.52,https://rss.dw.com/rdf/rss-en-world,Diplomático,NEU,0.0
2026-04-10 12:55,Germany,"International development aid suffers unprecedented 2025 dip, led by Trump gutting USAID","International development aid spending fell by more than one-fifth in real terms last year, the biggest dip on record. The US slashing its outlay by more than half set the tone, making Germany the largest overall donor.",1,52.52,13.4,https://rss.dw.com/rdf/rss-en-world,Humanitario,NEU,0.0
2026-04-10 12:55,Iran,Iran war: Tehran claims victory but people fear what's next,"As a tenuous truce takes hold after over a month of bombing, Iranians fear a wounded yet surviving regime will clamp down even more harshly on its opponents at home.",5,35.69,51.39,https://rss.dw.com/rdf/rss-en-world,Militar,NEU,0.0
2026-04-10 12:55,Ukraine,"Hungary election: Voters want new EU approach, but tough on Ukraine, poll shows","A new poll ahead of Hungary's election suggests that most voters want at least minor changes to ties with the EU. But it also found skepticism of financial support for Ukraine, and voters prioritizing domestic issues.",1,50.45,30.52,https://rss.dw.com/rdf/rss-en-world,Político,NEU,0.0
2026-04-10 12:55,Israel,Fragile Iran truce brings brief relief to African markets,"The truce between the US, Israel and Iran has eased pressure on African markets. But economists warn that deep‑rooted vulnerabilities mean the rebound may be short‑lived.",1,31.77,35.21,https://rss.dw.com/rdf/rss-en-world,Militar,NEU,0.0
2026-04-10 12:55,Ukraine,Fact check: Orban points to Ukraine over pipeline bomb,Orban strongly suggests explosives found near a key gas pipeline in Serbia are evidence of Ukrainian sabotage. Serbia's intelligence chief publicly disagrees.,1,50.45,30.52,https://rss.dw.com/rdf/rss-en-world,Energético,NEU,0.0
2026-04-10 12:55,Ukraine,Russia and Ukraine to hold 32-hour ceasefire for Orthodox Easter,Vladimir Putin and Volodymyr Zelenskyy have said their countries will hold a 32-hour ceasefire over the Orthodox Easter weekend.,4,50.45,30.52,https://feeds.skynews.com/feeds/rss/world.xml,Diplomático,NEU,0.0
2026-04-10 12:55,USA,Trump hits out at NATO after meeting alliance chief,Donald Trump has repeated his criticism of NATO after holding talks with the alliance's secretary general in Washington.,2,38.9,-77.04,https://feeds.skynews.com/feeds/rss/world.xml,Diplomático,NEU,0.0
2026-04-10 12:55,Iran,"Diesel and jet fuel shortages for some time, IMF warns","The world will experience diesel and jet fuel shortages ""for some time"" because of the war in Iran, according to the International Monetary Fund (IMF).",5,35.69,51.39,https://feeds.skynews.com/feeds/rss/world.xml,Militar,NEU,0.0
2026-04-10 12:55,Burkina Faso,Inside the secretive country run by a military leader with a cult following,"Few heads of state command a cult following like the young world leader and military ruler of Burkina Faso, President Ibrahim Traor&#233;.",1,12.37,-1.53,https://feeds.skynews.com/feeds/rss/world.xml,Militar,NEU,0.0
2026-04-10 12:55,Somalia,British man in court for leading fighters in African Islamist terror group,A British man has appeared in court accused of fighting as a platoon leader for Somalia-based Islamist terrorist group Al Shabaab.,3,2.05,45.34,https://feeds.skynews.com/feeds/rss/world.xml,Político,NEU,0.0
2026-04-10 12:55,Unknown,Irish army called in to remove fuel depot blockades,The Irish government has asked the army to help remove vehicles blocking fuel depots as protests entered a third day.,3,,,https://feeds.skynews.com/feeds/rss/world.xml,Político,NEU,0.0
2026-04-10 12:55,Norway,Inside underground Bond-like lair at heart of battle for the Arctic,"In Norway's High North, buried deep inside a mountain, sits a Bond-like lair.",2,59.91,10.75,https://feeds.skynews.com/feeds/rss/world.xml,General,NEU,0.0
2026-04-10 12:55,Taiwan,Taiwan opposition leader calls for ‘reconciliation’ after meeting Xi,KMT leader Cheng Li-wun stressed shared cultural heritage and suggested she would slow Taiwan&#039;s military build-up.,1,25.05,121.56,https://www.aljazeera.com/xml/rss/all.xml,Militar,NEU,0.0
2026-04-10 12:55,Lebanon,Will Israel and Lebanon start ceasefire talks?,Israel and Hezbollah continued to trade attacks on Friday - although at a reduced pace.,3,33.89,35.5,https://www.aljazeera.com/xml/rss/all.xml,Diplomático,NEU,0.0
2026-04-10 12:55,Lebanon,"Israel strikes residential areas, destroys homes in southern Lebanon","Lebanon is seeing not just a displacement crisis but a rapidly developing food security crisis too, says UN.",2,33.89,35.5,https://www.aljazeera.com/xml/rss/all.xml,General,NEU,0.0
2026-04-10 12:55,Israel,"Six months into ‘ceasefire’, Gaza suffers under persistent Israeli attacks","Gaza&#039;s devastation grows as over 72,000 people killed and 172,000 injured amid Israeli violations of US-brokered truce.",5,31.77,35.21,https://www.aljazeera.com/xml/rss/all.xml,Diplomático,NEU,0.0
2026-04-10 12:55,Indonesia,Torpedo-like object discovered by Indonesian fisherman,"A fisherman in Indonesia discovered a torpedo-like object near the Lombok Strait, a waterway between Bali and Lombok.",1,-6.21,106.85,https://www.aljazeera.com/xml/rss/all.xml,Energético,NEU,0.0
2026-04-10 12:55,Israel,Iran ceasefire: Not an off-ramp for the US but a life-saving ejection seat,A Middle Eastern country has for the first time single-handedly checked the war-making capabilities of the US and Israel,5,31.77,35.21,https://www.aljazeera.com/xml/rss/all.xml,Militar,NEU,0.0
2026-04-10 12:55,Ukraine,Russia and Ukraine agree to 32-hour Orthodox Easter ceasefire,Moscow and Kyiv signal a short Easter truce as diplomacy stalls and war pressures mount.,5,50.45,30.52,https://www.aljazeera.com/xml/rss/all.xml,Militar,NEU,0.0
2026-04-10 12:55,Myanmar,Myanmar’s coup leader Min Aung Hlaing sworn in as president,Min Aung Hlaing seeks to &#039;enhance&#039; international relations and ties with ASEAN after coup plunged Myanmar into chaos.,4,19.74,96.08,https://www.aljazeera.com/xml/rss/all.xml,Político,NEU,0.0
2026-04-10 12:55,Russia,Tyson Fury insists he’s ‘still got it’ ahead of Makhmudov comeback fight,"While eyeing a fight with Anthony Joshua, Fury first faces a Russian-born heavyweight who wrestled a bear for fun.",2,55.75,37.62,https://www.aljazeera.com/xml/rss/all.xml,General,NEU,0.0
2026-04-10 12:55,Pakistan,Iran war: What is happening on day 42 of US-Israeli attacks?,A Pakistan-brokered US-Iran ceasefire has taken effect but disputes over its scope are fuelling regional tensions.,5,33.72,73.06,https://www.aljazeera.com/xml/rss/all.xml,Militar,NEU,0.0
2026-04-10 12:55,Mali,"Energy prices may take ‘months’ to normalise, despite ceasefire: Analysts","There needs to be a predictable and stable flow of cargo through the strait before markets can stabilise, experts say.",4,12.65,-8.0,https://www.aljazeera.com/xml/rss/all.xml,Energético,NEU,0.0
2026-04-10 12:55,Palestine,Palestinian journalist describes losing prosthetic eye in Israeli prison,Palestinian journalist Muath Amarne said his prosthetic eye fell out after an infection while in Israeli detention.,1,31.9,35.3,https://www.aljazeera.com/xml/rss/all.xml,Humanitario,NEU,0.0
2026-04-10 12:55,Kuwait,"Kuwait blames Iran for drone strike, Iran denies responsibility","Kuwait is blaming ‘Iran and its proxies’ for a drone attack on Thursday night, while Iran has denied responsibility.",4,29.37,47.98,https://www.aljazeera.com/xml/rss/all.xml,Militar,NEU,0.0
2026-04-10 12:55,Iran,UK PM Keir Starmer visits Gulf to shore up ‘fragile’ US-Iran ceasefire,As UK PM Keir Starmer arrived in Doha as part of a Gulf tour he discussed efforts to secure the US-Iran ceasefire.,3,35.69,51.39,https://www.aljazeera.com/xml/rss/all.xml,Diplomático,NEU,0.0
2026-04-10 12:55,USA,Shipping in Strait of Hormuz at a standstill despite US-Iran ceasefire,Washington and Tehran accuse each other of not honouring truce agreement.,3,38.9,-77.04,https://www.aljazeera.com/xml/rss/all.xml,Energético,NEU,0.0
2026-04-10 12:55,Venezuela,Riot police push back protesters demanding higher wages in Venezuela,Police pushed back protesters in Venezuela’s capital as they demanded an increase to the minimum wage.,2,10.48,-66.88,https://www.aljazeera.com/xml/rss/all.xml,Político,NEU,0.0
2026-04-10 12:55,Lebanon,Iran war live: Israel attacks Lebanon again on eve of US-Iran truce talks,Iran’s parliament speaker warns that ‘time is running out’ as Israel continues to bombard Lebanon.,5,33.89,35.5,https://www.aljazeera.com/xml/rss/all.xml,Militar,NEU,0.0
2026-04-10 12:55,Iraq,Video shows explosion over Erbil in suspected drone interception,"Video shows an explosion in the sky above Erbil, in the Kurdish region of northern Iraq.",1,33.34,44.4,https://www.aljazeera.com/xml/rss/all.xml,General,NEU,0.0
2026-04-10 12:55,Iran,"Iran’s Supreme Leader Mojtaba Khamenei says ‘we seek compensation, not war’",Iranian state TV has read out a message from new Supreme Leader Mojtaba Khamenei which says Iran ‘does not want war’.,5,35.69,51.39,https://www.aljazeera.com/xml/rss/all.xml,Militar,NEU,0.0
2026-04-10 12:55,Venezuela,"Police in Venezuela block protesters calling for higher wages, pensions",Cost of living issues have persisted in Venezuela since the US abducted former President Nicolas Maduro in January.,2,10.48,-66.88,https://www.aljazeera.com/xml/rss/all.xml,Político,NEU,0.0
2026-04-10 12:55,Lebanon,US-Iran ceasefire: Uncertainty over what’s next,"Two‑week US‑Iran ceasefire pauses war; “who won?” unresolved as Hormuz, Lebanon strikes, Iran capabilities persist.",5,33.89,35.5,https://www.aljazeera.com/xml/rss/all.xml,Militar,NEU,0.0
