timestamp,pais,title,summary,score,lat,lon,source,categoria,sentiment,sentiment_score
2026-04-22 13:55,USA,Trump buys time for Iran deal after frantic day of diplomacy,"The US president's decision marked the second time in as many weeks he has backed off a threat to escalate the war, buying more time.",5,38.9,-77.04,http://feeds.bbci.co.uk/news/world/rss.xml,Militar,NEU,0.0
2026-04-22 13:55,Ukraine,EU approves €90bn loan for Ukraine as pipeline is turned on ending deadlock,"Ukraine says it has reopened the Druzhba pipeline, after months of stalemate over stalled oil supplies to neighbouring Hungary.",5,50.45,30.52,http://feeds.bbci.co.uk/news/world/rss.xml,Energético,NEU,0.0
2026-04-22 13:55,Israel,"Lufthansa cuts 20,000 summer flights as fuel prices surge",The airline is the latest to cut flights as the US-Israel war with Iran sends jet fuel prices soaring.,5,31.77,35.21,http://feeds.bbci.co.uk/news/world/rss.xml,Militar,NEU,0.0
2026-04-22 13:55,S. Korea,"South Korean fighter jets collided due to pilots taking pictures, report finds",One of the pilots has been fined thousands of dollars by the military to cover repair costs.,2,37.57,126.98,http://feeds.bbci.co.uk/news/world/rss.xml,Militar,NEU,0.0
2026-04-22 13:55,China,Taiwan president cancels trip after African countries revoke flight permits,Taiwan has accused Beijing of putting pressure on African countries to close their airspace to Lai's plane.,1,39.91,116.39,http://feeds.bbci.co.uk/news/world/rss.xml,Político,NEU,0.0
2026-04-22 13:55,Colombia,"UAE-backed Colombian mercenaries provided support to Sudan paramilitary, report says",The Conflict Insights Group (CIG) says its research also shows the extent of UAE involvement.,4,4.71,-74.07,http://feeds.bbci.co.uk/news/world/rss.xml,Militar,NEU,0.0
2026-04-22 13:55,India,Thirteen killed in second India fireworks blast in three days,"Earlier this week, an explosion at a firecracker factory in neighbouring state Tamil Nadu left at least 25 dead.",1,28.61,77.21,http://feeds.bbci.co.uk/news/world/rss.xml,General,NEU,0.0
2026-04-22 13:55,USA,From Epstein to sock puppets: Key takeaways from Kevin Warsh's Fed confirmation hearing,"He denied making a deal with Donald Trump on interest rates and backed ""policy regime change"" at the central bank.",1,38.9,-77.04,http://feeds.bbci.co.uk/news/world/rss.xml,Militar,NEU,0.0
2026-04-22 13:55,Israel,Iran sees mass redundancies from war with US and Israel,"The impact is being felt by manufacturers, retailers and the digital sector, amid warnings it could get worse if the war resumes.",5,31.77,35.21,http://feeds.bbci.co.uk/news/world/rss.xml,Militar,NEU,0.0
2026-04-22 13:55,Israel,Israeli soldiers punished over vandalism of Jesus statue in Lebanon,"Two soldiers will be removed from combat duty and receive 30 days of military detention, Israel's military says.",1,31.77,35.21,http://feeds.bbci.co.uk/news/world/rss.xml,Militar,NEU,0.0
2026-04-22 13:55,Ukraine,Zelensky says failure of US envoys to visit Kyiv is 'disrespectful',"US envoy Steve Witkoff and Donald Trump's son-in-law Jared Kushner have travelled to Moscow several times, but never to Kyiv.",1,50.45,30.52,http://feeds.bbci.co.uk/news/world/rss.xml,Diplomático,NEU,0.0
2026-04-22 13:55,Hungary,Unprecedented ruling finds Hungary's anti-LGBTQ laws in breach of EU values,The EU's top court finds that the reforms breached EU values on a number of levels and broke the founding values of the EU treaty.,1,47.5,19.04,http://feeds.bbci.co.uk/news/world/rss.xml,Político,NEU,0.0
2026-04-22 13:55,Japan,Japan loosens arms export rules in break from post-WW2 pacifism,This clears the way for Japan to sell weapons to more than a dozen countries.,1,35.69,139.69,http://feeds.bbci.co.uk/news/world/rss.xml,Militar,NEU,0.0
2026-04-22 13:55,Unknown,Madonna offers reward for return of missing Coachella costume,"The items, which she says are ""part of my history"", disappeared after her slot with Sabrina Carpenter.",5,,,http://feeds.bbci.co.uk/news/world/rss.xml,Militar,NEU,0.0
2026-04-22 13:55,Mexico,Role of US officials killed in crash in Mexico under scrutiny,Two Americans who reportedly worked for the CIA died in a car crash after a Mexican-led operation to destroy a drug lab.,4,19.43,-99.13,http://feeds.bbci.co.uk/news/world/rss.xml,General,NEU,0.0
2026-04-22 13:55,India/Pakistan,"A Kashmir tourist hotspot became a bloodbath. A year on, the pain remains unbearable","A year after militants killed 26 people in Indian-administered Kashmir, families are trying to cope with their loss.",4,32.0,76.0,http://feeds.bbci.co.uk/news/world/rss.xml,Político,NEU,0.0
2026-04-22 13:55,China,"Hotpot, bubble tea and sportswear: China's new exports take on the world","Made in China used to mean cheap, mass-produced goods but a new wave of Chinese brands is emerging.",1,39.91,116.39,http://feeds.bbci.co.uk/news/world/rss.xml,General,NEU,0.0
2026-04-22 13:55,Unknown,Hot air balloon makes emergency landing in California backyard,"""Look at that, wow!"" - A couple in Temecula woke up to find a balloon boarded with 13 people behind their home on Saturday.",3,,,http://feeds.bbci.co.uk/news/world/rss.xml,Político,NEU,0.0
2026-04-22 13:55,Iran,Are insider traders making millions from the Iran war?,The BBC has found significant spikes in activity shortly before the US president made some announcements.,5,35.69,51.39,http://feeds.bbci.co.uk/news/world/rss.xml,Militar,NEU,0.0
2026-04-22 13:55,Unknown,Victory slips away as marathon runner celebrates too soon,The dramatic end to the Delaware Marathon occurred when the lead runner slowed in celebration before a trailing marathoner sprinted toward the finish line .,1,,,http://feeds.bbci.co.uk/news/world/rss.xml,Militar,NEU,0.0
2026-04-22 13:55,Iran,US releases video of forces seizing Iranian ship,"The US has intercepted an Iranian-flagged cargo ship in the Gulf as part of its naval blockade, Donald Trump has said.",3,35.69,51.39,http://feeds.bbci.co.uk/news/world/rss.xml,Humanitario,NEU,0.0
2026-04-22 13:55,Iran,Will Iran war reshape global trade more than COVID?,"As the Iran war simmers, trade experts wonder if this conflict will reshape supply chains more than the pandemic. Companies are already rethinking strategies to future-proof revenues from other geopolitical risks.",2,35.69,51.39,https://rss.dw.com/rdf/rss-en-world,Militar,NEU,0.0
2026-04-22 13:55,Unknown,"Jet fuel crisis deepens as Lufthansa cuts 20,000 flights","The impact of jet fuel shortages because of the closure of the Strait of Hormuz is starting to burn. Lufthansa has canceled 20,000 flights and experts warn more cancellations and price hikes are on the way.",5,,,https://rss.dw.com/rdf/rss-en-world,Energético,NEU,0.0
2026-04-22 13:55,Afghanistan,US in talks to send Afghan refugees to DR Congo,Afghan allies who assisted US forces now face a stark choice: resettle in the war‑torn Democratic Republic of Congo or return to Taliban‑ruled Afghanistan.,5,34.52,69.18,https://rss.dw.com/rdf/rss-en-world,Militar,NEU,0.0
2026-04-22 13:55,USA,"Mexican pyramid gunman had materials tied to Columbine shooting, officials say","A 27-year-old suspect who opened fire at the Teotihuacan archaeological site possessed material related to the Columbine school shooting in the United States, Mexican authorities said.",1,38.9,-77.04,https://rss.dw.com/rdf/rss-en-world,Humanitario,NEU,0.0
2026-04-22 13:55,Lebanon,Lebanon war puts pregnant women at risk,Lebanon’s healthcare system is under severe strain despite a temporary ceasefire between Israel and Hezbollah. Thousands of displaced pregnant women are struggling to access medical services.,5,33.89,35.5,https://rss.dw.com/rdf/rss-en-world,Militar,NEU,0.0
2026-04-22 13:55,Turkey,How grievance turns to violence in a mass shooter's mind,"Attacks like last week's school shooting in Turkey can seem to come out of nowhere, but they rarely do. Instead, a buildup of grievance and fixation often precedes the the moment violent thoughts become violent acts.",3,39.93,32.86,https://rss.dw.com/rdf/rss-en-world,General,NEU,0.0
2026-04-22 13:55,S. Korea,"Hormuz crisis forces Japan, South Korea to rethink strategy","The Strait of Hormuz blockade has shaken Tokyo and Seoul, highlighting their dependence on maritime trade for essential goods including food and fuel.",2,37.57,126.98,https://rss.dw.com/rdf/rss-en-world,Energético,NEU,0.0
2026-04-22 13:55,Nigeria,Nigeria's $2B energy bailout tests President Tinubu reforms,"Nigeria has approved billions to clear power sector debts. Analysts say the move may stabilize electricity supply, but deeper structural problems remain unresolved.",1,9.07,7.4,https://rss.dw.com/rdf/rss-en-world,Energético,NEU,0.0
2026-04-22 13:55,Bulgaria,What course will Bulgaria’s new leader Rumen Radev take?,"The trained pilot, former general and ex-president says he will crack down on corruption and seek dialogue with Russia. But who is Rumen Radev, the man who swept to victory in Sunday’s election?",1,42.7,23.32,https://rss.dw.com/rdf/rss-en-world,Político,NEU,0.0
2026-04-22 13:55,Iran,How does the war in Iran end?,"<a href=""https://podfollow.com/the-world-with-richard-and-yalda"">👉Listen to The World with Richard Engel and Yalda Hakim on your podcast app👈</a>",5,35.69,51.39,https://feeds.skynews.com/feeds/rss/world.xml,Militar,NEU,0.0
2026-04-22 13:55,Unknown,"Pope warns humanity's at risk, in new plea to world leaders","The Pope has warned humanity's future risks being ""tragically compromised"" due to a breakdown of international law and political responsibility.",5,,,https://feeds.skynews.com/feeds/rss/world.xml,Político,NEU,0.0
2026-04-22 13:55,Israel,Two IDF soldiers jailed over smashing of Jesus statue,Two Israeli soldiers have been jailed for 30 days and removed from combat duty after a statue of Jesus was destroyed.&#160;,1,31.77,35.21,https://feeds.skynews.com/feeds/rss/world.xml,Militar,NEU,0.0
2026-04-22 13:55,Unknown,"Airline cuts 20,000 flights","Lufthansa has said 20,000 short-haul flights are being cut from its schedule this summer, allowing it to save on the soaring cost of jet fuel.",1,,,https://feeds.skynews.com/feeds/rss/world.xml,Energético,NEU,0.0
2026-04-22 13:55,Israel,"We would arrest Netanyahu, says Hungary's incoming PM",Hungary's incoming prime minister has said he'll stop the country's withdrawal from the International Criminal Court (ICC).,1,31.77,35.21,https://feeds.skynews.com/feeds/rss/world.xml,Político,NEU,0.0
2026-04-22 13:55,Lebanon,"Rebuilding Gaza will cost more than &#163;50bn, says UN","While the focus of many in the Middle East has been on conflicts in Lebanon and Iran, the scale of damage in Gaza is also back under scrutiny.&#160;",4,33.89,35.5,https://feeds.skynews.com/feeds/rss/world.xml,Diplomático,NEU,0.0
2026-04-22 13:55,Israel,IDF soldier damages Jesus statue with sledgehammer in Lebanon - as Netanyahu responds,"Israel's prime minister Benjamin Netanyahu condemned ""in the strongest terms"" images of an Israeli soldier damaging a statue of Jesus.",1,31.77,35.21,https://feeds.skynews.com/feeds/rss/world.xml,Militar,NEU,0.0
2026-04-22 13:55,Israel,Five major issues affecting the FIFA World Cup with 50 days to go,"From the US-Israel war on Iran to exorbitant ticket prices and violence in host nations, here&#039;s what&#039;s gone wrong.",5,31.77,35.21,https://www.aljazeera.com/xml/rss/all.xml,Militar,NEU,0.0
2026-04-22 13:55,Palestine,Israeli settlers set Palestinian home on fire in occupied West Bank,Israeli settlers set Palestinian home on fire in occupied West Bank,1,31.9,35.3,https://www.aljazeera.com/xml/rss/all.xml,General,NEU,0.0
2026-04-22 13:55,Palestine,Kyrie Irving changes Instagram photo to show solidarity with Palestine,NBA player&#039;s profile image shows a Palestinian child blocked from school by Israeli soldiers in the occupied West Bank.,1,31.9,35.3,https://www.aljazeera.com/xml/rss/all.xml,Militar,NEU,0.0
2026-04-22 13:55,India,Why is India’s Manipur burning for three years?,"After three years of ethnic clashes, Manipur still remains on edge, with fears that the conflict could spiral further.",3,28.61,77.21,https://www.aljazeera.com/xml/rss/all.xml,General,NEU,0.0
2026-04-22 13:55,Peru,Peru’s election chief steps down amid chaotic general election,The head of Peru’s election authority was heckled by protesters after announcing his resignation.,2,-12.05,-77.04,https://www.aljazeera.com/xml/rss/all.xml,Político,NEU,0.0
2026-04-22 13:55,Iran,Iran seizes two vessels in Strait of Hormuz after ship comes under fire,The IRGC says the aggression came in response to what it described as the US seizure of an Iranian commercial vessel.,1,35.69,51.39,https://www.aljazeera.com/xml/rss/all.xml,Energético,NEU,0.0
2026-04-22 13:55,Ukraine,"Russia strikes Ukraine’s Odesa port, kills railway worker in Zaporizhia",Ukraine&#039;s deputy prime minister says the attacks on the country&#039;s civilian infrastructure are &#039;another proof of terrorism&#039;.,4,50.45,30.52,https://www.aljazeera.com/xml/rss/all.xml,Humanitario,NEU,0.0
2026-04-22 13:55,Lebanon,Israel attacks mosque in Lebanon in another ceasefire violation,Israel attacks mosque in Lebanon in another ceasefire violation,3,33.89,35.5,https://www.aljazeera.com/xml/rss/all.xml,Diplomático,NEU,0.0
2026-04-22 13:55,Palestine,Gaza’s unseen casualties: A surge in stillbirths and birth defects,Gaza sees a 140% rise in stillbirths and a doubling of congenital anomalies as the devastating impacts of war linger.,5,31.9,35.3,https://www.aljazeera.com/xml/rss/all.xml,Militar,NEU,0.0
2026-04-22 13:55,China,"LeBron James nets 28, Lakers grab 2-0 lead on Rockets in NBA Playoff series","Kevin Durant scores 23 for Houston but the Lakers bag a 101-94 win despite a depleted team, with Luka Doncic missing.",1,39.91,116.39,https://www.aljazeera.com/xml/rss/all.xml,General,NEU,0.0
2026-04-22 13:55,Israel,Israel’s ‘digital occupation’ of south Lebanon,"Al Jazeera’s Linh Nguyen explains Israeli drones above the skies in Lebanon, which critics call a &quot;digital occupation.&quot;",1,31.77,35.21,https://www.aljazeera.com/xml/rss/all.xml,General,NEU,0.0
2026-04-22 13:55,China,How China is gaining from Iran war by showing it is different from US,"Beijing has leveraged its strong economic relationship with the US, Israel, Iran and the Gulf to keep its stakes safe.",5,39.91,116.39,https://www.aljazeera.com/xml/rss/all.xml,Militar,NEU,0.0
2026-04-22 13:55,USA,Iran’s UN ambassador responds to US ceasefire extension,Iran’s UN Ambassador has responded to US President Donald Trump’s announcement of an extension to the ceasefire.,3,38.9,-77.04,https://www.aljazeera.com/xml/rss/all.xml,Diplomático,NEU,0.0
2026-04-22 13:55,Iran,US halts shipment of Iraq’s oil dollars to curb Iran-linked groups: WSJ,"A plane carrying nearly $500m in US banknotes was blocked by the US Treasury, according to The Wall Street Journal.",1,35.69,51.39,https://www.aljazeera.com/xml/rss/all.xml,Energético,NEU,0.0
2026-04-22 13:55,Mexico,World Cup host Mexico pledges security at tourist sites after shooting,Mexican president admits the archaeological site outside Mexico City lacked security measures to prevent the attack.,3,19.43,-99.13,https://www.aljazeera.com/xml/rss/all.xml,Político,NEU,0.0
2026-04-22 13:55,Bangladesh,Is Bangladesh killing reforms introduced after student-led protests?,A new parliament has cancelled several reforms that were brought in after Hasina&#039;s ouster to improve accountability.,2,23.81,90.41,https://www.aljazeera.com/xml/rss/all.xml,Político,NEU,0.0
2026-04-22 13:55,USA,Iran war: What’s happening on day 54 as Trump extends ceasefire?,Trump said the US would extend the ceasefire with Iran until it presents a proposal and talks conclude.,5,38.9,-77.04,https://www.aljazeera.com/xml/rss/all.xml,Diplomático,NEU,0.0
2026-04-22 13:55,Iran,Tehran held military parades as ceasefire was set to end,Videos show large crowds attending a military parade in Tehran on Tuesday as the US-Iran ceasefire deadline approached.,4,35.69,51.39,https://www.aljazeera.com/xml/rss/all.xml,Militar,NEU,0.0
2026-04-22 13:55,Israel,Argentina’s Milei sings and lights torch for Israeli national day,Argentine President Javier Milei sang and lit a ceremonial torch at Israel&#039;s 78th Independence Day celebrations.,1,31.77,35.21,https://www.aljazeera.com/xml/rss/all.xml,Político,NEU,0.0
