timestamp,pais,title,summary,score,lat,lon,source,categoria,sentiment,sentiment_score
2026-04-15 16:55,Lebanon,Israel and Hezbollah continue attacks after Israel-Lebanon talks in US,"Israel strikes hit southern Lebanon and Hezbollah fires rockets at Israel, a day after rare direct negotiations.",3,33.89,35.5,http://feeds.bbci.co.uk/news/world/rss.xml,Diplomático,NEU,0.0
2026-04-15 16:55,USA,Trump's rift with Pope is playing out in public - it's costing him valuable support,Leading conservative Catholics tell the BBC why they back the American pontiff in his spat with Trump.,1,38.9,-77.04,http://feeds.bbci.co.uk/news/world/rss.xml,General,NEU,0.0
2026-04-15 16:55,Sri Lanka,Sri Lanka repatriates 238 Iranian sailors stranded after US torpedo attack,"The survivors of the US attack on Iranian vessel Iris Dena, which claimed the lives of 104 people, were among those sent home.",3,6.93,79.85,http://feeds.bbci.co.uk/news/world/rss.xml,General,NEU,0.0
2026-04-15 16:55,USA,Trump threatens to fire Fed chair Powell if he doesn't leave in May,Donald Trump's threat marks the latest escalation in his ongoing spat with Jerome Powell.,3,38.9,-77.04,http://feeds.bbci.co.uk/news/world/rss.xml,General,NEU,0.0
2026-04-15 16:55,Turkey,Four killed in second Turkish school shooting in two days,"Three students and one teacher died in the attack, according to the local governor.",4,39.93,32.86,http://feeds.bbci.co.uk/news/world/rss.xml,General,NEU,0.0
2026-04-15 16:55,S. Korea,South Korea jails American YouTuber for public nuisance,Johnny Somali sparked outrage after kissing a statue representing World War Two sex slaves.,5,37.57,126.98,http://feeds.bbci.co.uk/news/world/rss.xml,Militar,NEU,0.0
2026-04-15 16:55,UN,250 missing after migrant boat sinks in Indian Ocean,"The trawler ""reportedly sank due to heavy winds, rough seas and overcrowding"", the United Nations said.",1,40.75,-73.97,http://feeds.bbci.co.uk/news/world/rss.xml,Humanitario,NEU,0.0
2026-04-15 16:55,Iran,"'Bit of pain' worth long-term security from Iran, Bessent tells BBC","US Treasury Secretary said a ""small bit of economic pain"" was worth it to eliminate the threat of Iranian strikes on Western capitals.",2,35.69,51.39,http://feeds.bbci.co.uk/news/world/rss.xml,Humanitario,NEU,0.0
2026-04-15 16:55,USA,Starmer says he's 'not going to yield' to pressure from Trump on Iran war,"It follows a warning from the US president that America's trade deal with the UK ""can always be changed"".",5,38.9,-77.04,http://feeds.bbci.co.uk/news/world/rss.xml,Militar,NEU,0.0
2026-04-15 16:55,Lebanon,Israel and Lebanon hold first direct talks since 1993,"A US statement said the two sides had agreed to launch direct negotiations, at a time and place to be determined.",2,33.89,35.5,http://feeds.bbci.co.uk/news/world/rss.xml,Diplomático,NEU,0.0
2026-04-15 16:55,USA,Watch: Vance heckled as he chides Pope,"The US Vice-President was speaking at a Turning Point USA event, where he said Pope Leo should ""be careful when he talks about matters of theology.""",1,38.9,-77.04,http://feeds.bbci.co.uk/news/world/rss.xml,Diplomático,NEU,0.0
2026-04-15 16:55,Iran,Kenya fuel prices rise sharply despite reduction in tax due to Iran war,Diesel prices rise by a record margin despite a reduction in value added tax.,5,35.69,51.39,http://feeds.bbci.co.uk/news/world/rss.xml,Militar,NEU,0.0
2026-04-15 16:55,Palestine,"Hamas rejects Gaza disarmament plan, Palestinian official says",The official tells the BBC that the armed group will not move forward with talks until Israel fully complies with its commitments.,5,31.9,35.3,http://feeds.bbci.co.uk/news/world/rss.xml,Militar,NEU,0.0
2026-04-15 16:55,Unknown,Partner of US influencer who died in Zanzibar speaking to police as witness,"The police said Ashly Robinson, known online as Ashlee Jenae, had died after attempting to take her own life.",1,,,http://feeds.bbci.co.uk/news/world/rss.xml,Humanitario,NEU,0.0
2026-04-15 16:55,Hungary,JD Vance defends backing 'great guy' Orbán's campaign after landslide defeat,"Hungary's leader was a ""great guy"" who did a ""very good job"", the US vice-president said, but he was sure he could work with Péter Magyar.",1,47.5,19.04,http://feeds.bbci.co.uk/news/world/rss.xml,Político,NEU,0.0
2026-04-15 16:55,Iran,"US blockade of Iran ports irresponsible and dangerous, China says","China, the biggest buyer of Iranian oil, says the US naval blockade undermines an ""already fragile ceasefire"".",3,35.69,51.39,http://feeds.bbci.co.uk/news/world/rss.xml,Energético,NEU,0.0
2026-04-15 16:55,Sudan,Three years of messages at once - a chronicle of Sudan's war pours in as trapped reporter's phone turns on,"As the conflict enters its fourth year, journalist Mohamed Suleiman shudders at what has been lost.",5,15.55,32.53,http://feeds.bbci.co.uk/news/world/rss.xml,Militar,NEU,0.0
2026-04-15 16:55,Pakistan,Hospital at centre of child HIV outbreak caught reusing syringes in undercover filming,"Footage shows staff in Pakistan injecting without gloves and reusing syringes, but the hospital boss refuses to acknowledge it is genuine.",1,33.72,73.06,http://feeds.bbci.co.uk/news/world/rss.xml,Humanitario,NEU,0.0
2026-04-15 16:55,Lebanon,"Lebanon seeks peace, but Hezbollah needs to be convinced first",The Lebanese government go into peace talks with limited influence over the group.,1,33.89,35.5,http://feeds.bbci.co.uk/news/world/rss.xml,Diplomático,NEU,0.0
2026-04-15 16:55,South Africa,Can this man broaden the appeal of a South African party seen by some as 'too white'?,"The Democratic Alliance's new leader, Geordin Hill-Lewis, admits the party's support is too narrow.",2,-25.75,28.19,http://feeds.bbci.co.uk/news/world/rss.xml,Diplomático,NEU,0.0
2026-04-15 16:55,Iran,The US blockade of Iran is a gamble. Will it work?,The US military is gambling on the blockade denying Iran vital trade - but questions remain on whether the bet will pay off.,3,35.69,51.39,http://feeds.bbci.co.uk/news/world/rss.xml,Militar,NEU,0.0
2026-04-15 16:55,Iran,Why and how is US blockading Iranian ports in Strait of Hormuz?,Donald Trump says that the US is blockading the Strait of Hormuz. What does this mean in practice?,1,35.69,51.39,http://feeds.bbci.co.uk/news/world/rss.xml,Energético,NEU,0.0
2026-04-15 16:55,Unknown,Moment gunman tackled by school principal,CCTV footage shows a high school principal charging towards a former student who was armed in Oklahoma.,5,,,http://feeds.bbci.co.uk/news/world/rss.xml,Militar,NEU,0.0
2026-04-15 16:55,Sudan,"The human cost of the war in Sudan, three years on","The conflict, which erupted in 2023, has left behind a human toll which is ""simply staggering"", reports the BBC's Barbara Plett Usher.",5,15.55,32.53,http://feeds.bbci.co.uk/news/world/rss.xml,Militar,NEU,0.0
2026-04-15 16:55,Iran,US blockade of Iranian ports explained in two minutes,The BBC's security correspondent Frank Gardner explains how the US blockade of Iranian ports will work.,3,35.69,51.39,http://feeds.bbci.co.uk/news/world/rss.xml,General,NEU,0.0
2026-04-15 16:55,Unknown,Celebrities and fans pay tributes to Asha Bhosle,Asha Bhosle died in Mumbai on Sunday after being admitted to the hospital following a heart attack.,3,,,http://feeds.bbci.co.uk/news/world/rss.xml,Humanitario,NEU,0.0
2026-04-15 16:55,Lebanon,What's behind Israel's attacks along Lebanon's Litani River?,"Israel is pushing forward with plans to remove Lebanese homes and residents from between the Litani River and its own border, creating a buffer zone. Why is the area strategically important in the Middle East conflict?",2,33.89,35.5,https://rss.dw.com/rdf/rss-en-world,Militar,NEU,0.0
2026-04-15 16:55,Iran,Iran: Hundreds of thousands of jobs lost due to war,"After six weeks of war, job losses are growing in Iran. Destroyed industrial facilities have brought production in many sectors to a standstill, hitting Iranian workers particularly hard.",1,35.69,51.39,https://rss.dw.com/rdf/rss-en-world,Militar,NEU,0.0
2026-04-15 16:55,India,India's aviation boom hits turbulence amid Iran war,"From longer routes to higher fares, the Middle East conflict is exposing vulnerabilities in India's fast-growing airline sector.",5,28.61,77.21,https://rss.dw.com/rdf/rss-en-world,Militar,NEU,0.0
2026-04-15 16:55,Sudan,"Nuba Mountains, a fragile refuge on Sudan's front line","Squeezed between Sudan and South Sudan, the self-governed Nuba Mountains are grappling with complex war dynamics while hosting hundreds of thousands of refugees they are scarcely able to support.",5,15.55,32.53,https://rss.dw.com/rdf/rss-en-world,Militar,NEU,0.0
2026-04-15 16:55,China,France's Renault slashes engineer jobs amid pressure from Chinese carmakers,"The French carmaker said it would cut up to 2,400 engineering jobs as the company tries to catch up to Chinese electric vehicles in terms of price and production speed.",1,39.91,116.39,https://rss.dw.com/rdf/rss-en-world,Humanitario,NEU,0.0
2026-04-15 16:55,Lebanon,Lebanon: Debate over fake 'plot' to overthrow government,"Locals are questioning stories about whether Israel saved Lebanon from a coup to overthrow its government when it bombed Beirut. The debate underscores how divided the country is, as Israel-Lebanon talks begin.",3,33.89,35.5,https://rss.dw.com/rdf/rss-en-world,Político,NEU,0.0
2026-04-15 16:55,Israel,Antisemitic violence at record high for Jews outside Israel,"As Israel marks Holocaust Remembrance Day, a new report by Tel Aviv University shows surging cases of severe violence against Jews in the West in 2025.",1,31.77,35.21,https://rss.dw.com/rdf/rss-en-world,General,NEU,0.0
2026-04-15 16:55,Germany,"Sudan: Iran war prompts 'massive' food, fuel price rises; drones kill hundreds of civilians in 2026",German charities warn of increases of 70-80% in the costs of essentials in wartorn Sudan amid the unrest in the Middle East. Donors gather in Berlin on Wednesday on the third anniversary of the outbreak of the war.,5,52.52,13.4,https://rss.dw.com/rdf/rss-en-world,Militar,NEU,0.0
2026-04-15 16:55,USA,Venezuela: President Rodriguez's first 100 days in power,"After the US ousted Venezuela's leader Nicolas Maduro, Washington outlined a three-phase plan for the country. Now, 100 days into interim President Delcy Rodriguez's tenure, the question looms: Will she allow elections?",1,38.9,-77.04,https://rss.dw.com/rdf/rss-en-world,Político,NEU,0.0
2026-04-15 16:55,Iran,Iran war: US blockade of Hormuz tests China's restraint,"China, the largest buyer of Iranian oil, is weighing the fallout of the US naval blockade of Iran's ports and ships in the Strait of Hormuz. Could Beijing be drawn into the conflict?",5,35.69,51.39,https://rss.dw.com/rdf/rss-en-world,Energético,NEU,0.0
2026-04-15 16:55,Turkey,Student kills four people in Turkey's second school shooting in two days,"A student has killed at least four people in Turkey's second school shooting in two days, officials said.",4,39.93,32.86,https://feeds.skynews.com/feeds/rss/world.xml,Humanitario,NEU,0.0
2026-04-15 16:55,Kuwait,"Journalist detained in Kuwait after posting Iran war video, activists say","A journalist has been detained in Kuwait after posting videos related to the war in Iran, according to a press freedom advocacy group.",5,29.37,47.98,https://feeds.skynews.com/feeds/rss/world.xml,Militar,NEU,0.0
2026-04-15 16:55,Iran,How Trump is blockading Iran's ports and ships in the Strait of Hormuz,The US Navy is blockading Iranian ports after talks between the two countries broke down over the weekend.,1,35.69,51.39,https://feeds.skynews.com/feeds/rss/world.xml,Militar,NEU,0.0
2026-04-15 16:55,N. Korea,North Korea tests cruise missiles from new warship as Kim Jong Un watches,"North Korea carried out missile tests from its new warship over the weekend, observed by leader Kim Jong Un.",5,39.02,125.75,https://feeds.skynews.com/feeds/rss/world.xml,Militar,NEU,0.0
2026-04-15 16:55,Sudan,‘Erosion of a country’s future’: What has the war cost Sudan?,"Sudan&#039;s civil war, which erupted three years ago, has devastated civilian infrastructure, pushed millions into misery.",5,15.55,32.53,https://www.aljazeera.com/xml/rss/all.xml,Militar,NEU,0.0
2026-04-15 16:55,Sudan,"Every 27 minutes, someone is killed in Sudan’s war","Every day, over the last three years in Sudan, 53 people on average are killed.",5,15.55,32.53,https://www.aljazeera.com/xml/rss/all.xml,Militar,NEU,0.0
2026-04-15 16:55,Palestine,Italian magazine cover of Israeli settler sparks diplomatic backlash,Italian magazine cover showing an armed Israeli settler grinning at a Palestinian woman has sparked backlash from Israel,2,31.9,35.3,https://www.aljazeera.com/xml/rss/all.xml,Diplomático,NEU,0.0
2026-04-15 16:55,Pakistan,US-Iran talks: What’s the latest on mediation efforts?,Tehran rejects US conditions on nuclear arms; sanctions relief and strait control fuel diplomatic deadlock in Islamabad.,5,33.72,73.06,https://www.aljazeera.com/xml/rss/all.xml,Diplomático,NEU,0.0
2026-04-15 16:55,Lebanon,What people in Lebanon are saying about talks with Israel,This is how people in Lebanon are reacting to the country’s first direct talks with Israel in decades.,1,33.89,35.5,https://www.aljazeera.com/xml/rss/all.xml,Diplomático,NEU,0.0
2026-04-15 16:55,Iran,What are Iran’s $100bn in frozen assets and where are they held?,Iran wants the US to release its frozen assets as part of talks. The money could help it rebuild its battered economy.,1,35.69,51.39,https://www.aljazeera.com/xml/rss/all.xml,Diplomático,NEU,0.0
2026-04-15 16:55,Palestine,"As world focuses on Iran, Israel ‘engineering starvation policy’ in Gaza","The weaponisation of logistics has caused severe shortage of fuel, food and medicines piling misery on Palestinians.",1,31.9,35.3,https://www.aljazeera.com/xml/rss/all.xml,Militar,NEU,0.0
2026-04-15 16:55,Unknown,Four people killed in Turkiye’s second school shooting in two days,"Three students and a teacher are killed in the south-central province of ​Kahramanmaras, governor says.",4,,,https://www.aljazeera.com/xml/rss/all.xml,General,NEU,0.0
2026-04-15 16:55,Saudi Arabia,Asian Cup 2027 draw in Saudi Arabia moved to May 9 over Iran war,"Draw for the 24-team 2027 AFC Asian Cup, originally set for Saturday, moved to May 9.",5,24.69,46.72,https://www.aljazeera.com/xml/rss/all.xml,Militar,NEU,0.0
2026-04-15 16:55,Lebanon,Anger in Lebanon as Israel launches deadly strikes despite diplomatic drive,"Hezbollah lawmaker Hassan Fadlallah says negotiating &#039;with the enemy is wrong&#039;, warns of &#039;internal division&#039;.",5,33.89,35.5,https://www.aljazeera.com/xml/rss/all.xml,Diplomático,NEU,0.0
2026-04-15 16:55,Israel,"Double standards? Why Iran’s nukes are scrutinised, Israel gets a pass",Israel’s policy of ambiguity about its nuclear capability contrasts sharply with the focus on Iran’s programme.,5,31.77,35.21,https://www.aljazeera.com/xml/rss/all.xml,General,NEU,0.0
2026-04-15 16:55,Israel,Italy suspends long-standing defence agreement with Israel,"Italy suspended the renewal of a 20-year-long defence agreement with Israel, following recent tensions between them.",2,31.77,35.21,https://www.aljazeera.com/xml/rss/all.xml,Diplomático,NEU,0.0
2026-04-15 16:55,Israel,What you need to know about Israel’s ambassador to the US,Israel’s ambassador held talks with his Lebanese counterpart. But critics say Yechiel Leiter is a problematic negotiator,2,31.77,35.21,https://www.aljazeera.com/xml/rss/all.xml,Diplomático,NEU,0.0
2026-04-15 16:55,France,France’s Ekitike to miss World Cup after Liverpool Champions League injury,Liverpool striker Hugo Ekitike had to be stretchered off in the Champions League defeat by Paris Saint-Germain.,1,48.86,2.35,https://www.aljazeera.com/xml/rss/all.xml,General,NEU,0.0
2026-04-15 16:55,France,Iran citizen held in France over pro-Palestine comments returns home,Release of Mahdieh Esfandiari comes a week after Iran released two French citizens held on espionage charges.,1,48.86,2.35,https://www.aljazeera.com/xml/rss/all.xml,General,NEU,0.0
2026-04-15 16:55,N. Korea,"North Korea boosting ability to manufacture nuclear arms, IAEA chief warns",The nuclear watchdog&#039;s chief says there is a rapid increase in operations at North Korea&#039;s Yongbyon reactor.,1,39.02,125.75,https://www.aljazeera.com/xml/rss/all.xml,Militar,NEU,0.0
2026-04-15 16:55,Palestine,Palestinian leader Barghouti endures ‘violent’ assaults in Israeli prisons,Recent reports of prison brutality follow an attack last year that resulted in broken ribs and head injuries.,3,31.9,35.3,https://www.aljazeera.com/xml/rss/all.xml,General,NEU,0.0
2026-04-15 16:55,Lebanon,‘Food is unifying’: How Lebanon’s migrants are feeding the war-displaced,"Often overlooked in Lebanon&#039;s society, the migrant community is filling the gaps of the state by feeding their own.",5,33.89,35.5,https://www.aljazeera.com/xml/rss/all.xml,Militar,NEU,0.0
2026-04-15 16:55,Sudan,"Families across Sudan endure years of displacement, hunger, loss","More than nine million people remain displaced in Sudan, while nearly 29 million face acute hunger.",1,15.55,32.53,https://www.aljazeera.com/xml/rss/all.xml,Humanitario,NEU,0.0
2026-04-15 16:55,USA,Iran war: What is happening on day 47 of the US-Iran conflict?,US President Donald Trump has signalled a possible second round of talks with Iran in the coming days.,5,38.9,-77.04,https://www.aljazeera.com/xml/rss/all.xml,Militar,NEU,0.0
2026-04-15 16:55,Israel,"Trump turns on Meloni, saying she lacks ‘courage’ over US-Israel war on Iran","The US president says he is &#039;shocked at her&#039;, delivering a blunt public rebuke to one of his closest European allies.",5,31.77,35.21,https://www.aljazeera.com/xml/rss/all.xml,Militar,NEU,0.0
