timestamp,pais,title,summary,score,lat,lon,source,categoria,sentiment,sentiment_score
2026-04-09 23:55,Israel,"Israel to hold direct talks with Lebanon but no ceasefire, Netanyahu says",Lebanese officials had called for a ceasefire before talks begin.,3,31.77,35.21,http://feeds.bbci.co.uk/news/world/rss.xml,Diplomático,NEU,0.0
2026-04-09 23:55,USA,Trump criticises Nato as alliance chief describes meeting as 'very frank',"The US president says Nato ""wasn't there when we needed them"" during the Iran war.",5,38.9,-77.04,http://feeds.bbci.co.uk/news/world/rss.xml,Diplomático,NEU,0.0
2026-04-09 23:55,Israel,Al Jazeera condemns killing of journalist in Israeli strike in Gaza,"The Israeli military claims Mohammed Wishah was a ""Hamas terrorist"" - which the Qatar-based network has previously denied.",1,31.77,35.21,http://feeds.bbci.co.uk/news/world/rss.xml,Militar,NEU,0.0
2026-04-09 23:55,Iran,"'Endless fears': Even if fighting stops, the damage to Iran's children will endure",The BBC has been able to obtain testimony from parents and those trying to help children deal with the distress that comes with war.,5,35.69,51.39,http://feeds.bbci.co.uk/news/world/rss.xml,Militar,NEU,0.0
2026-04-09 23:55,Unknown,Artemis crew returning to Earth with 'all the good stuff' from Moon discoveries,"The four astronauts said they were returning to Earth with ""so many more pictures, so many more stories"".",1,,,http://feeds.bbci.co.uk/news/world/rss.xml,Humanitario,NEU,0.0
2026-04-09 23:55,Unknown,He's Australia's most decorated soldier. Now he's at the centre of a historic war crimes case,"Ben Roberts-Smith's case is not only unprecedented for Australia but ""extraordinary"" for the globe too, scholars say.",1,,,http://feeds.bbci.co.uk/news/world/rss.xml,Militar,NEU,0.0
2026-04-09 23:55,China,Pioneering wildlife cameraman Doug Allan dies after falling ill in Nepal,The cameraman and photographer won eight Emmy Awards for his work on acclaimed series like Blue Planet alongside Sir David Attenborough.,5,39.91,116.39,http://feeds.bbci.co.uk/news/world/rss.xml,Militar,NEU,0.0
2026-04-09 23:55,Unknown,Best-selling The Housemaid author Freida McFadden reveals true identity,"One of the biggest mysteries in publishing is solved, as The Housemaid writer reveals her real name.",1,,,http://feeds.bbci.co.uk/news/world/rss.xml,Humanitario,NEU,0.0
2026-04-09 23:55,Unknown,Petrol and diesel prices rise again as concerns grow over ceasefire,Motoring groups have warned drivers not to expect a significant drop in costs soon.,5,,,http://feeds.bbci.co.uk/news/world/rss.xml,Militar,NEU,0.0
2026-04-09 23:55,Iran,Ships remain cautious approaching Strait of Hormuz amid fragile ceasefire,"Only a few vessels have crossed the strait since the US-Iran ceasefire deal, according to BBC Verify analysis.",3,35.69,51.39,http://feeds.bbci.co.uk/news/world/rss.xml,Energético,NEU,0.0
2026-04-09 23:55,Unknown,'Ketamine Queen' sentenced to 15 years in Matthew Perry overdose death,Jasveen Sangha was found guilty of selling drugs that killed Friends actor Matthew Perry who had struggled with addiction for years.,2,,,http://feeds.bbci.co.uk/news/world/rss.xml,General,NEU,0.0
2026-04-09 23:55,Unknown,Prosecutors seek Tiger Woods' prescription drug records after Florida arrest,"A legal order seeking the golfer's medications - including dosage and warnings about driving on pill bottles - will be issued later this month, court record shows.",2,,,http://feeds.bbci.co.uk/news/world/rss.xml,Militar,NEU,0.0
2026-04-09 23:55,Germany,Germany suspends military approval for long stays abroad for men under 45,The requirement to obtain permission had gone largely unnoticed until a German newspaper reported on it.,1,52.52,13.4,http://feeds.bbci.co.uk/news/world/rss.xml,Militar,NEU,0.0
2026-04-09 23:55,Nigeria,Nigeria begins mass trial of 500 terrorism suspects,Very few people are ever prosecuted following terror attacks with suspects often held without trial.,2,9.07,7.4,http://feeds.bbci.co.uk/news/world/rss.xml,General,NEU,0.0
2026-04-09 23:55,Cameroon,Cameroon 'military contractors' killed in Russia-Ukraine war - BBC confirms leaked message,The government usually refrains from commenting on the participation of its citizens in the conflict.,5,3.87,11.52,http://feeds.bbci.co.uk/news/world/rss.xml,Militar,NEU,0.0
2026-04-09 23:55,Iran,Madagascar declares state of emergency over severe fuel shortages linked to Iran war,The presidency says it is taking action as it fears fuel shortages could lead to public disorder.,5,35.69,51.39,http://feeds.bbci.co.uk/news/world/rss.xml,Energético,NEU,0.0
2026-04-09 23:55,Unknown,Newlywed wife of US soldier freed by ICE after detention at military base,"Annie Ramos, an undocumented immigrant who came to the US as a toddler, had gone to the base to complete paperwork so the couple could move in together.",3,,,http://feeds.bbci.co.uk/news/world/rss.xml,Militar,NEU,0.0
2026-04-09 23:55,Unknown,Man fined after breaking into viral hippo Moo Deng's enclosure,The director of the Thai zoo where Moo Deng lives said security would be upped after the incident.,1,,,http://feeds.bbci.co.uk/news/world/rss.xml,Humanitario,NEU,0.0
2026-04-09 23:55,Lebanon,Lebanon thought there was a ceasefire - then Israel unleashed deadly blitz,Israel says Lebanon is not included in the ceasefire the US agreed to halt the war with Iran.,5,33.89,35.5,http://feeds.bbci.co.uk/news/world/rss.xml,Militar,NEU,0.0
2026-04-09 23:55,Iran,Has US achieved its war objectives in Iran?,Key US objectives at the start of the war were to stop Iran getting a nuclear weapon and degrading its arsenal.,5,35.69,51.39,http://feeds.bbci.co.uk/news/world/rss.xml,Militar,NEU,0.0
2026-04-09 23:55,Israel,What we know about the two-week ceasefire between the US and Iran,The provisional truce comes more than a month after the US and Israel launched coordinated attacks on Iran.,3,31.77,35.21,http://feeds.bbci.co.uk/news/world/rss.xml,Diplomático,NEU,0.0
2026-04-09 23:55,Venezuela,The US refinery now processing Venezuelan oil,"Chevron is now importing 250,000 barrels of crude per day from Venezuela.",1,10.48,-66.88,http://feeds.bbci.co.uk/news/world/rss.xml,Energético,NEU,0.0
2026-04-09 23:55,India,Indian migrant workers hit by cooking gas shortages are leaving cities,Migrant workers say they are struggling to access cooking gas cylinders as the Iran war squeezes supplies.,5,28.61,77.21,http://feeds.bbci.co.uk/news/world/rss.xml,Militar,NEU,0.0
2026-04-09 23:55,Israel,BBC at the site of Israeli air strikes in Beirut,"At least 182 people were killed and 890 others wounded, according to the Lebanese health ministry.",4,31.77,35.21,http://feeds.bbci.co.uk/news/world/rss.xml,General,NEU,0.0
2026-04-09 23:55,Ukraine,Ukraine: Russia's Putin declares Easter ceasefire,"Russian President Putin has announced a ceasefire in Russia's war in Ukraine over the Orthodox Easter holiday. Ukrainian President Zelenskyy said his country will ""act accordingly"" during the truce.",5,50.45,30.52,https://rss.dw.com/rdf/rss-en-world,Militar,NEU,0.0
2026-04-09 23:55,Ukraine,Ukraine and Syria tighten relations,"Ukrainian President Volodymyr Zelenskyy’s visit to Syria was not only a diplomatic gesture but motivated by strategic considerations regarding Russia, once a strong supporter of the Middle Eastern state.",3,50.45,30.52,https://rss.dw.com/rdf/rss-en-world,Diplomático,NEU,0.0
2026-04-09 23:55,Germany,"International development aid suffers unprecedented 2025 dip, led by Trump gutting USAID","International development aid spending fell by more than one-fifth in real terms last year, the biggest dip on record. The US slashing its outlay by more than half set the tone, making Germany the largest overall donor.",1,52.52,13.4,https://rss.dw.com/rdf/rss-en-world,Humanitario,NEU,0.0
2026-04-09 23:55,Iran,Iran war: Tehran claims victory but people fear what's next,"As a tenuous truce takes hold after over a month of bombing, Iranians fear a wounded yet surviving regime will clamp down even more harshly on its opponents at home.",5,35.69,51.39,https://rss.dw.com/rdf/rss-en-world,Militar,NEU,0.0
2026-04-09 23:55,Ukraine,"Hungary election: Voters want new EU approach, but tough on Ukraine, poll shows","A new poll ahead of Hungary's election suggests that most voters want at least minor changes to ties with the EU. But it also found skepticism of financial support for Ukraine, and voters prioritizing domestic issues.",1,50.45,30.52,https://rss.dw.com/rdf/rss-en-world,Político,NEU,0.0
2026-04-09 23:55,Israel,Fragile Iran truce brings brief relief to African markets,"The truce between the US, Israel and Iran has eased pressure on African markets. But economists warn that deep‑rooted vulnerabilities mean the rebound may be short‑lived.",1,31.77,35.21,https://rss.dw.com/rdf/rss-en-world,Militar,NEU,0.0
2026-04-09 23:55,Ukraine,Fact check: Orban points to Ukraine over pipeline bomb,Orban strongly suggests explosives found near a key gas pipeline in Serbia are evidence of Ukrainian sabotage. Serbia's intelligence chief publicly disagrees.,1,50.45,30.52,https://rss.dw.com/rdf/rss-en-world,Energético,NEU,0.0
2026-04-09 23:55,UAE,Facts vs. influencers: Is the 'Dubai dream' really over?,"Some residents in Dubai insist life is going on as normal in the eternally-sunny emirate during the Iran war. Others proclaim the ""Dubai dream"" over, never to be recovered. Who's right?",1,24.47,54.37,https://rss.dw.com/rdf/rss-en-world,Militar,NEU,0.0
2026-04-09 23:55,USA,Guinea-Bissau on edge after activist's killing,"The death of activist Vigario Luis Balanta, found with signs of extreme violence, has triggered protests and accusations against Guinea-Bissau's military rulers, raising concerns over repression and media freedom.",2,38.9,-77.04,https://rss.dw.com/rdf/rss-en-world,Militar,NEU,0.0
2026-04-09 23:55,Hungary,Hungarian election: How football has helped Orban keep power,"Viktor Orban is a football fanatic but has long used the sport as a political tool, both in Hungary and abroad. With polls predicting election defeat, he could also lose his chance of hosting the Champions League final.",1,47.5,19.04,https://rss.dw.com/rdf/rss-en-world,Político,NEU,0.0
2026-04-09 23:55,USA,Trump hits out at NATO after meeting alliance chief,Donald Trump has repeated his criticism of NATO after holding talks with the alliance's secretary general in Washington.,2,38.9,-77.04,https://feeds.skynews.com/feeds/rss/world.xml,Diplomático,NEU,0.0
2026-04-09 23:55,Iran,"Diesel and jet fuel shortages for some time, IMF warns","The world will experience diesel and jet fuel shortages ""for some time"" because of the war in Iran, according to the International Monetary Fund (IMF).",5,35.69,51.39,https://feeds.skynews.com/feeds/rss/world.xml,Militar,NEU,0.0
2026-04-09 23:55,Burkina Faso,Inside the secretive country run by a military leader with a cult following,"Few heads of state command a cult following like the young world leader and military ruler of Burkina Faso, President Ibrahim Traor&#233;.",1,12.37,-1.53,https://feeds.skynews.com/feeds/rss/world.xml,Militar,NEU,0.0
2026-04-09 23:55,Somalia,British man in court for leading fighters in African Islamist terror group,A British man has appeared in court accused of fighting as a platoon leader for Somalia-based Islamist terrorist group Al Shabaab.,3,2.05,45.34,https://feeds.skynews.com/feeds/rss/world.xml,Político,NEU,0.0
2026-04-09 23:55,Unknown,Irish army called in to remove fuel depot blockades,The Irish government has asked the army to help remove vehicles blocking fuel depots as protests entered a third day.,3,,,https://feeds.skynews.com/feeds/rss/world.xml,Político,NEU,0.0
2026-04-09 23:55,USA,Oil prices fall sharply after Trump announces two-week Iran war ceasefire,Oil prices have fallen sharply and stock markets have soared on news of a two-week ceasefire between the US and Iran.,2,38.9,-77.04,https://feeds.skynews.com/feeds/rss/world.xml,Militar,NEU,0.0
2026-04-09 23:55,USA,What is Iran's 10-point peace plan - and what has Trump said?,"Donald Trump says the US has received a ""workable"" peace plan from Iran after the two countries agreed to a two-week ceasefire, labelling it a ""complete victory"" for his nation.",3,38.9,-77.04,https://feeds.skynews.com/feeds/rss/world.xml,Diplomático,NEU,0.0
2026-04-09 23:55,UK,British teen dies in Vietnam,A 19-year-old from the UK has died after a reported motorbike crash in Vietnam.,1,51.51,-0.13,https://feeds.skynews.com/feeds/rss/world.xml,General,NEU,0.0
2026-04-09 23:55,Israel,Hospitals in Beirut struggle to deal with casualties after Israeli attacks,Doctors warn of worsening crises as vital supplies run low and Israeli attacks devastate Beirut and surrounding areas.,5,31.77,35.21,https://www.aljazeera.com/xml/rss/all.xml,Militar,NEU,0.0
2026-04-09 23:55,Morocco,CAF President Motsepe rejects Senegal’s corruption claim amid AFCON fallout,Senegal&#039;s government alleged corruption at African football&#039;s governing body after AFCON title awarded to Morocco.,1,33.99,-6.85,https://www.aljazeera.com/xml/rss/all.xml,Político,NEU,0.0
2026-04-09 23:55,Palestine,Rafah crossing restrictions derail Palestinian student’s academic dreams,"A Medical student was holding onto hopes of being a doctor, when the Gaza war caused restriction on attaining education.",5,31.9,35.3,https://www.aljazeera.com/xml/rss/all.xml,Militar,NEU,0.0
2026-04-09 23:55,Israel,"Netanyahu: ‘No ceasefire in Lebanon’, Israel open to peace talks",Israeli Prime Minister Benjamin Netanyahu emphasised that a ceasefire is not in effect in Lebanon,3,31.77,35.21,https://www.aljazeera.com/xml/rss/all.xml,Diplomático,NEU,0.0
2026-04-09 23:55,Israel,"Gaza journalists mourn Al Jazeera’s Wishah, killed by Israel",Wishah is latest Al Jazeera journalist to be killed by Israel in Gaza since the start of the war in October 2023.,5,31.77,35.21,https://www.aljazeera.com/xml/rss/all.xml,Militar,NEU,0.0
2026-04-09 23:55,Iran,Khamenei says Tehran ‘astonished the world’ during US-Israeli war on Iran,"In a statement read out on television, Mojtaba Khamenei said Tehran will &#039;demand compensation&#039; for war damages.",5,35.69,51.39,https://www.aljazeera.com/xml/rss/all.xml,Militar,NEU,0.0
2026-04-09 23:55,Iran,Iran: Strait of Hormuz open with restrictions,Iran’s Deputy Foreign Minister says the Strait of Hormuz is open but ships must coordinate with Iranian forces.,1,35.69,51.39,https://www.aljazeera.com/xml/rss/all.xml,Energético,NEU,0.0
2026-04-09 23:55,Saudi Arabia,Saudi Arabia says operational activities halted at several energy sites,"Attacks on energy facilities cause a reduced supply and slow recovery, a Saudi official tells state news agency.",3,24.69,46.72,https://www.aljazeera.com/xml/rss/all.xml,Energético,NEU,0.0
2026-04-09 23:55,Lebanon,Why is Hezbollah a sticking point in the Iran ceasefire?,Lebanese armed group is an ally of Tehran but still under attack from Israel.,3,33.89,35.5,https://www.aljazeera.com/xml/rss/all.xml,Diplomático,NEU,0.0
2026-04-09 23:55,USA,US led ‘historic’ foreign aid decline in 2025 amid Trump cuts: OECD,A forum of top economies in Europe and Americas says aid from members declined 23 percent as humanitarian needs grow.,1,38.9,-77.04,https://www.aljazeera.com/xml/rss/all.xml,Humanitario,NEU,0.0
2026-04-09 23:55,Israel,Scale of Beirut destruction revealed after wave of Israeli strikes,The damage from Israel’s devastating strikes on Beirut on Tuesday is coming into focus now that the smoke has cleared.,1,31.77,35.21,https://www.aljazeera.com/xml/rss/all.xml,General,NEU,0.0
2026-04-09 23:55,Israel,Iran says it ‘would be dumb’ for US to let Netanyahu kill diplomacy,"In an implicit response to JD Vance, Iran&#039;s Abbas Araghchi warns of the repercussions of Israel&#039;s attacks on Lebanon.",5,31.77,35.21,https://www.aljazeera.com/xml/rss/all.xml,Militar,NEU,0.0
2026-04-09 23:55,Iran,Iranians rally nationwide to honour late leader Ali Khamenei,"Thousands gathered across Iran to honor Ali Khamenei, whose assassination marked the start of the US-Israeli attack.",3,35.69,51.39,https://www.aljazeera.com/xml/rss/all.xml,Político,NEU,0.0
2026-04-09 23:55,Russia,UK says three Russian submarines tracked during ‘covert’ operation,British defence minister says the operation did not find evidence that Russia had damaged undersea infrastructure.,1,55.75,37.62,https://www.aljazeera.com/xml/rss/all.xml,Político,NEU,0.0
2026-04-09 23:55,Iran,Zohran Mamdani on 100 days as New York mayor,"NYC’s mayor reflects on childcare, housing, bigotry, Iran and the future of the Democratic Party.",1,35.69,51.39,https://www.aljazeera.com/xml/rss/all.xml,Político,NEU,0.0
2026-04-09 23:55,Lebanon,US Democrats warn Trump that Iran ceasefire must apply to Lebanon,Democratic lawmakers tell White House that allowing Israel to continue to bomb Lebanon could reignite the regional war.,5,33.89,35.5,https://www.aljazeera.com/xml/rss/all.xml,Militar,NEU,0.0
2026-04-09 23:55,Israel,Sidon residents recall horror of Israeli strikes after Iran ceasefire,Residents in Sidon are surveying the destruction after Israeli strikes flattened a religious complex.,3,31.77,35.21,https://www.aljazeera.com/xml/rss/all.xml,Diplomático,NEU,0.0
2026-04-09 23:55,Iran,Does a US-Iran ceasefire mean the end of the war?,"After a US-Iran ceasefire deal, strikes slow but tensions remain. Will this hold or collapse?",5,35.69,51.39,https://www.aljazeera.com/xml/rss/all.xml,Militar,NEU,0.0
