ts,title,summary,source,score,pais,timestamp,lat,lon,categoria,sentiment,sentiment_score
,"Russia's 'shadow fleet' of old tankers isn't just evading sanctions, it's wrecking the environment","A Russian oil and gas tanker that was likely targeted by drones is adrift in the Mediterranean with no crew onboard. Experts warn that if the vessel leaks, it will be devastating for the environment.",https://rss.dw.com/rdf/rss-en-world,5,Russia,2026-03-22 20:57:00,61.5,105.3,Militar,,
,Aftermath of Iranian missile strikes near Israel’s nuclear facility,It was the first time Iranian missiles had penetrated Israeli air defence systems in the area around a key nuclear site.,https://www.aljazeera.com/xml/rss/all.xml,5,Israel,2026-03-22 20:57:00,0.0,0.0,Militar,,
,‘Opening Strait of Hormuz will probably require US boots on the ground’,‘Opening Strait of Hormuz will probably require US boots on the ground’,https://www.aljazeera.com/xml/rss/all.xml,1,Unknown,2026-03-22 21:20:00,,,Energético,,
,Latin American presidents criticise US actions,Latin American leaders met at the CELAC Summit in Colombia where President Petro called for a Middle East ceasefire.,https://www.aljazeera.com/xml/rss/all.xml,3,Colombia,2026-03-22 21:20:00,4.71,-74.07,Diplomático,,
,Iran war is creating ‘heightened risks of instability across countries in A,David Owiro says that African countries are particularly vulnerable to the economic consequences of the Iran war.,https://www.aljazeera.com/xml/rss/all.xml,5,Iran,2026-03-22 21:20:00,35.69,51.39,Militar,,
